,0
2103,New crypto owners nearly doubled in 3 key regions in 2021: Report
2104,Cryptos on the rise 2022 | Thomson Reuters
2105,Why Hong Kong's crypto crown is slipping - Financial Times
2106,"Crypto Scams in Hong Kong and Points to Note | Oldham, Li & Nie"
2107,Global crypto awareness: Singapore beats Canada and Hong Kong
2108,Hungary crypto ownership numbers
2109,Cryptocurrency usage in Hungary 2021 - Statista
2110,[PDF] Cryptocurrency regulations by country - Thomson Reuters
2111,Cryptos on the rise 2022 | Thomson Reuters
2112,Cryptocurrency Regulations in Hungary - Gurcan Partners Law Firm
2113,Hungary Plans to Cut Taxes On Bitcoin In Half - Nasdaq
2114,Five arrests in Hungary for money laundering across three continents
2115,Hungary Bends to EU Demands as Forint Woes Add Urgency for ...
2116,[PDF] Hungary 2021 - OECD Economic Surveys
2117,Iceland crypto ownership numbers
2118,Global Cryptocurrency Ownership Data 2021 - TripleA
2119,Largest Bitcoin Mining Farms in the World | Sunbird DCIM
2120,Iceland's Big Bitcoin Heist | Vanity Fair
2121,Bitcoin mining: Is Scandinavia's cryptoboom coming to an end? - DW
2122,Russia Values Local Crypto at $200 Billion as Rules Near
2123,"Bitcoin mini-mining rig costs $875, lets owner mine from Starbucks"
2124,Cryptocurrencies - On the cusp of mainstream? - Mercer
2125,Top ten companies with most bitcoin hold over 204000 in total
2126,Bitcoin Mining Uses More Energy Than Homes Do in Iceland - Fortune
2127,India crypto ownership numbers
2128,Cryptocurrency Ownership Data for India 2021 - TripleA
2129,India has highest number of crypto owners in the world at 10.07 crore
2130,Cryptocurrency adoption index and patterns in India: Finder's report ...
2131,"India has more than 10 crore crypto owners now, highest in the world"
2132,India Tops The List Of Crypto Ownership With 100 Million Hodlers ...
2133,Finder Cryptocurrency Adoption Index - finder India
2134,"India has world's largest number of crypto owners, most under 35"
2135,India Has Highest Number of Cryptocurrency Owners in the World at ...
2136,Why estimates of India's crypto-owning population could be ...
2137,Indonesia crypto ownership numbers
2138,Indonesia Enjoys The Highest Crypto Adoption Rate Worldwide: Study
2139,Indonesia's crypto industry in 2021: A kaleidoscope - Cointelegraph
2140,Over 6.5 million Indonesians bought or sold crypto in first 5 ... - KrASIA
2141,A Simple Guide to Trading Cryptocurrency in Indonesia
2142,Finder Cryptocurrency Adoption Index - finder Indonesia
2143,Indonesia's Growing Crypto Industry
2144,11% of Indonesians own cryptocurrency - Asia Times
2145,Indonesia and Brazil lead the world among cryptocurrency investors
2146,Indonesian Crypto Industry in 2021: A Kaleidoscope - LinkedIn
2147,Iran crypto ownership numbers
2148,"Up to 12 Million Iranians Own Cryptocurrency, Traders Choose ..."
2149,Global Cryptocurrency Ownership Data 2021 - TripleA
2150,How Iran Uses Bitcoin Mining to Evade Sanctions - Elliptic
2151,Cryptos on the rise 2022 | Thomson Reuters
2152,[PDF] The 2020 Geography of Cryptocurrency Report - Gov.bc.ca
2153,Inside Iran's Onslaught on Bitcoin Mining - CoinDesk
2154,Iran: Majlis Enters the Crypto Fray - Financial Tribune
2155,Bitcoin ban: These are the countries where crypto is restricted or illegal
2156,Top ten companies with most bitcoin hold over 204000 in total
2157,Drought and Crypto Mining Fuel Iran's Business-Choking Blackouts
2158,Iraq crypto ownership numbers
2159,Global Cryptocurrency Ownership Data 2021 - TripleA
2160,[PDF] Regulation of Cryptocurrency Around the World: November 2021 ...
2161,10 Cities That Are Bitcoin Hotspots - Investopedia
2162,Bitcoin ban: These are the countries where crypto is restricted or illegal
2163,Regulating cryptocurrencies | Deloitte Iraq | ME PoV issue 25
2164,Crypto is fully banned in China and 8 other countries - Fortune
2165,"Global Crypto Users Can Reach 1 Billion by December 2022, says ..."
2166,Iraq's financial inclusion drive boosted by homegrown fintech
2167,75 Cryptocurrency Statistics Show Crypto's Gone Mainstream
2168,Ireland crypto ownership numbers
2169,Global Cryptocurrency Ownership Data 2021 - TripleA
2170,Ireland Named 6th Most 'Crypto-ready' Country in the World
2171,Cryptocurrencies and crypto-assets - Revenue
2172,Most cryptocurrency owners are in their 20s and 30s - Independent.ie
2173,Cryptos on the rise 2022 | Thomson Reuters
2174,[PDF] Cryptocurrency regulations by country - Thomson Reuters
2175,Crypto countries: Tracking global interest in cryptocurrencies
2176,FINTECH: New crypto owners nearly doubled in 3 key r... - IFC Review
2177,Israel crypto ownership numbers
2178,Report: One third of Israelis and Emiratis own cryptocurrency
2179,[PDF] Blockchain for SMEs and entrepreneurs in Israel - OECD
2180,Survey Shows Crypto Usage in the Middle East on the Rise
2181,Welcome to the Crypto Age | Israel Innovation
2182,New crypto owners nearly doubled in 3 key regions in 2021: Report
2183,[PDF] Cryptocurrency regulations by country - Thomson Reuters
2184,Cryptos on the rise 2022 | Thomson Reuters
2185,10 Cities That Are Bitcoin Hotspots - Investopedia
2186,Italy crypto ownership numbers
2187,Ownership of cryptocurrency in Italy 2018 - Statista
2188,Bitcoin investments among users of Italy's GimmeLike 2021 - Statista
2189,Italy Crypto Adoption Statistics— Data Shows Surging Interest
2190,[PDF] Blockchain for SMEs and entrepreneurs in Italy - OECD
2191,Blockchain & Cryptocurrency Laws and Regulations | Italy | GLI
2192,[PDF] COUNTRY UPDATE-Italy: Crypto-asset regulation - NET
2193,Cryptocurrency Concerns vs Regulations in Europe - CoinShares
2194,[PDF] Cryptocurrency adoption rates - Finder - 3 Bit Lab
2195,Ivory Coast crypto ownership numbers
2196,Global Cryptocurrency Ownership Data 2021 - TripleA
2197,INSIGHT-How bitcoin met the real world in Africa | Reuters
2198,Crypto's Greatest Challenge: Legitimacy or Acceptance?
2199,Cryptocurrency: The 'Afro' struggles to become the bitcoin of Africa
2200,"Ivory Coast, Ghana to raise cocoa origin differentials in August"
2201,How Many People Own Bitcoin? 95 Blockchain Statistics (2022)
2202,Bitcoin ownership is on the rise in Canada | Ipsos
2203,Figure of the week: The rapidly increasing role of cryptocurrencies in ...
2204,Ivory Coast Gets Profile Boost as Eni Discovers More Oil and Gas
2205,Jamaica crypto ownership numbers
2206,Global Cryptocurrency Ownership Data 2021 - TripleA
2207,Jamaica Offers Free Money to Digital Currency's First Adopters
2208,"'No Cash, No Problem': Jamaica Picks Tagline for New E-Currency"
2209,Today in Crypto: Jamaica Incentivizes New Users | PYMNTS.com
2210,Top ten companies with most bitcoin hold over 204000 in total
2211,Why criminals can't hide behind Bitcoin | Science | AAAS
2212,Cryptocurrencies and Digital money - DW Observatory
2213,Cryptocurrencies and blockchain - World Bank Documents
2214,"Cryptocurrency attracting Black, Latino investors and fans - ABC News"
2215,Japan crypto ownership numbers
2216,Number of crypto asset accounts in Japan 2018-2021 - Statista
2217,Global Cryptocurrency Ownership Data 2021 - TripleA
2218,Japan's $1 Trillion Crypto Market May Ease Onerous Listing Rules
2219,Japan's cryptocurrency market: Set to bloom or wither?
2220,Japan a global leader in cryptocurrency investment
2221,What countries use cryptocurrency the most? | World Economic Forum
2222,How Many People Own Bitcoin? 95 Blockchain Statistics (2022)
2223,Blockchain & Cryptocurrency Laws and Regulations | Japan | GLI
2224,Jordan crypto ownership numbers
2225,"63+ Cryptocurrency Statistics, Facts & Trends - Buy Bitcoin Worldwide"
2226,Global Cryptocurrency Ownership Data 2021 - TripleA
2227,15 Essential Cryptocurrency Stats for 2022 - Influencer Marketing Hub
2228,Russia Values Local Crypto at $200 Billion as Rules Near
2229,10 Cities That Are Bitcoin Hotspots - Investopedia
2230,INSIGHT-How bitcoin met the real world in Africa | Reuters
2231,How Many People Own Bitcoin? 95 Blockchain Statistics (2022)
2232,Legality of cryptocurrency by country or territory - Wikipedia
2233,Inside the Jordan refugee camp that runs on blockchain
2234,Kazakhstan crypto ownership numbers
2235,Global Cryptocurrency Ownership Data 2021 - TripleA
2236,"Even in Kazakhstan, Bitcoin Can't Escape Geopolitics - JSTOR Daily"
2237,Kazakh Ministers Suggest Tenfold Increase In Cryptocurrency Tax
2238,Kazakhstan and Cryptocurrency - Freeman Law
2239,Crypto miners in Kazakhstan face bitter winter of power cuts
2240,Crypto miners to file quarterly reports with Kazakhstan authorities
2241,Why Kazakhstan is attracting bitcoin miners - Asia Times
2242,Kazakhstan's bitcoin 'paradise' may be losing its lustre
2243,The legal regulations and perspectives of cryptocurrency in ...
2244,Bitcoin network power slumps as Kazakhstan crackdown hits crypto ...
2245,Kenya crypto ownership numbers
2246,"4.2 million Kenyans own crypto, highest in Africa – report - Technext"
2247,Kenya Has Highest Proportion of Crypto Owning Citizens in Africa ...
2248,Kenyan crypto traders trying to 'buy the dip' got burned - Quartz
2249,Blockchain & Cryptocurrency Laws and Regulations | Kenya | GLI
2250,Crypto countries: Tracking global interest in cryptocurrencies
2251,This map shows where cryptocurrency is taking off around the world
2252,2021 Global Crypto Adoption Index Up 880% - Chainalysis Blog
2253,[PDF] Blockchain and Cryptocurrency in Africa - Baker McKenzie
2254,Kuwait crypto ownership numbers
2255,Global Cryptocurrency Ownership Data 2021 - TripleA
2256,[PDF] The 2020 Geography of Cryptocurrency Report - Gov.bc.ca
2257,Morocco tops Arab world in terms of crypto owners followed by Egypt
2258,30 Brand New Cryptocurrency Statistics for 2022 - Exploding Topics
2259,Top ten companies with most bitcoin hold over 204000 in total
2260,[PDF] Regulation of Cryptocurrency Around the World: November 2021 ...
2261,Best Crypto Exchange in Kuwait for July 2022 - Business 2 Community
2262,How to Buy Bitcoin Kuwait in August 2022 - Business 2 Community
2263,"Cryptocurrency - data, statistics and visualizations - knoema.com"
2264,Kyrgyzstan crypto ownership numbers
2265,Global Cryptocurrency Ownership Data 2021 - TripleA
2266,The Present and Future of Crypto Mining in Kyrgyzstan amid Energy ...
2267,Chain and silk: alternative futures of blockchain governance in ...
2268,"The9 Limited and SolarCoin, a Kyrgyzstan Cryptomining Company ..."
2269,Legality of cryptocurrency by country or territory - Wikipedia
2270,[PDF] Regulation of Cryptocurrency Around the World: November 2021 ...
2271,National market structure – Kyrgyzstan energy profile – Analysis - IEA
2272,[PDF] Tax and Investment Guide Kyrgyz Republic - Deloitte
2273,(PDF) Chain and silk: alternative futures of blockchain governance ...
2274,Laos crypto ownership numbers
2275,Global Cryptocurrency Ownership Data 2021 - TripleA
2276,Laos pushes into crypto as it authorises mining and trading
2277,Asian Nation Laos to Legalize Bitcoin Mining And Trading - Nasdaq
2278,"The LAO: A For-Profit, Limited Liability Autonomous Organization"
2279,[PDF] Enhancing capacities on digital G2P and G2B transfers ... - ESCAP
2280,Warnings of Sovereign Defaults in Asia Frontier Markets Flare Up
2281,Digital 2021 Laos (January 2021) v01 - SlideShare
2282,"As Laos rolls out welcome mat for crypto mining, big questions ..."
2283,Why criminals can't hide behind Bitcoin | Science | AAAS
2284,Latvia crypto ownership numbers
2285,Global Cryptocurrency Ownership Data 2021 - TripleA
2286,[PDF] Cryptocurrency regulations by country - Thomson Reuters
2287,[PDF] Compendium – Cryptocurrency regulations by country
2288,[PDF] EU Blockchain Ecosystem developments
2289,Crypto-assets in Latvia: first steps in evaluation - Macroeconomics.lv
2290,[PDF] Cryptocurrencies: An empirical view from a tax perspective
2291,5 things to know about Blockchain in Latvia / Article - LSM.LV
2292,75 Cryptocurrency Statistics Show Crypto's Gone Mainstream
2293,Lebanon crypto ownership numbers
2294,The crypto dons of Beirut - Rest of World
2295,Lebanese turn to cryptocurrency as economy tanks - Al-Monitor
2296,"In Lebanon, bitcoin is proving to be a safe bet | Middle East Eye"
2297,Bitcoin in Beirut: Cryptocurrency Adoption in the Face of Financial ...
2298,Why Bitcoin Should Be The Saving Choice of Lebanon | Nasdaq
2299,How refugees in Lebanon can benefit from cryptocurrencies to ...
2300,FEATURE-Young Lebanese driving crypto 'revolution' after banks go ...
2301,Morocco tops Arab world in terms of crypto owners followed by Egypt
2302,Libya crypto ownership numbers
2303,Global Cryptocurrency Ownership Data 2021 - TripleA
2304,Cryptocurrencies rise in popularity in world's conflict zones | Bitcoin
2305,[PDF] Libya Financial Sector Review - Pubdocs.worldbank.org.
2306,"Crypto and the Dollar Are Partners, Not Rivals - Bloomberg.com"
2307,INSIGHT-How bitcoin met the real world in Africa | Reuters
2308,Libya and Cryptocurrency - Freeman Law
2309,Why criminals can't hide behind Bitcoin | Science | AAAS
2310,The intelligence coup of the century - The Washington Post
2311,The climate controversy swirling around NFTs - The Verge
2312,Lithuania crypto ownership numbers
2313,Global Cryptocurrency Ownership Data 2021 - TripleA
2314,Lithuania Cryptocurrency Regulation 2022 - Crypto License
2315,[PDF] Lithuania's ICO Guidelines
2316,[PDF] Cryptocurrency regulations by country - Thomson Reuters
2317,[PDF] Compendium – Cryptocurrency regulations by country
2318,Cryptocurrency fever persists in Lithuania: the number of the ...
2319,Lithuania Crypto License - Costs and Requirements | Money Gate
2320,"lithuania cryptocurrency, lithuania crypto exchange license"
2321,Luxembourg crypto ownership numbers
2322,"Cryptocurrency ownership in Luxembourg in 2018, by type - Statista"
2323,Familiarity in Luxembourg with cryptocurrency in 2018 - Statista
2324,Global Cryptocurrency Ownership Data 2021 - TripleA
2325,[PDF] Crypto-assets: Paradigm shift or short-term trend? - PwC Luxembourg
2326,Cryptocurrency Regulations Around The World - ComplyAdvantage
2327,Cryptocurrency Concerns vs Regulations in Europe - CoinShares
2328,Blockchain means we've already passed 'peak fund' - Schroders
2329,[PDF] Cryptocurrencies: Tracing the Evolution of Criminal Finances - Europol
2330,"[PDF] Crypto-assets - Key developments, regulatory concerns and ..."
2331,Macao crypto ownership numbers
2332,Global Cryptocurrency Ownership Data 2021 - TripleA
2333,Hongkongers are among the world's biggest investors in ...
2334,Macau Covid News: City to Reopen With Casino Revenue at Record ...
2335,"One in 10 eurozone households own cryptoassets, says ECB |"
2336,Blockchain.com wallets 2011-2022 - Statista
2337,"[PDF] Macao, China - FATF"
2338,Opinion: China's bitcoin crackdown is not its final act | IFLR
2339,Bitcoin Awareness And Adoption In Singapore Is Huge - Nasdaq
2340,[PDF] The 2020 Geography of Cryptocurrency Report - Gov.bc.ca
2341,Madagascar crypto ownership numbers
2342,Global Cryptocurrency Ownership Data 2021 - TripleA
2343,INSIGHT-How bitcoin met the real world in Africa | Reuters
2344,The rise of crypto adoption in Africa - International Finance Magazine
2345,Why criminals can't hide behind Bitcoin | Science | AAAS
2346,Madagascar and Cryptocurrency - Freeman Law
2347,Why famine in Madagascar is an alarm bell for the planet
2348,2019 Investment Climate Statements: Madagascar - State Department
2349,Madagascar Car Registrations - July 2022 Data - 2011-2021 Historical
2350,The Business Benefit of Using Cryptocurrency | Deloitte US
2351,Malawi crypto ownership numbers
2352,Global Cryptocurrency Ownership Data 2021 - TripleA
2353,THE EXTENT OF CRYPTOCURRENCIES IN MALAWI Prepared for ...
2354,Crypto-currency adoption in Africa: The ups and downs
2355,Building Ethereum Dapps: Decentralized applications on the ...
2356,INSIGHT-How bitcoin met the real world in Africa | Reuters
2357,How to Buy Bitcoin in Malawi with Kwacha Instantly - Yellow Card
2358,Crypto millionaires building their own cities in Central America
2359,The Bitcoin Whales: 1000 People Who Own 40 Percent of the Market
2360,This map shows where cryptocurrency is taking off around the world
2361,Malaysia crypto ownership numbers
2362,Crypto Ownership Data for Malaysia 2021 - TripleA
2363,Malaysia's crypto scene is booming. What are the risks?
2364,"Cryptocurrency ownership in Nigeria, Malaysia highest in the world"
2365,Malaysia is well placed to become a regional crypto hub - Capital.com
2366,Malaysians Into Crypto - DailyStraits.com
2367,Cryptocurrency adoption by country 2019-2021 - Statista
2368,Global crypto users could reach one billion by end of 2022
2369,Malaysia's crypto scene a goldmine for scammers
2370,Malaysia is ambivalent about crypto - Kapronasia
2371,Maldives crypto ownership numbers
2372,Global Cryptocurrency Ownership Data 2021 - TripleA
2373,Cryptocurrencies and blockchain - World Bank Documents
2374,Why criminals can't hide behind Bitcoin | Science | AAAS
2375,Digital 2022: Big Rise in Cryptocurrency Ownership - DataReportal
2376,The Business Benefit of Using Cryptocurrency | Deloitte US
2377,Corporates investing in crypto | Deloitte US
2378,"India, Maldives sign six pacts; widen defence partnership"
2379,How Many People Own Bitcoin? 95 Blockchain Statistics (2022)
2380,Global Financial Crisis - an overview | ScienceDirect Topics
2381,Mali crypto ownership numbers
2382,Global Cryptocurrency Ownership Data 2021 - TripleA
2383,INSIGHT-How bitcoin met the real world in Africa | Reuters
2384,Crypto's Greatest Challenge: Legitimacy or Acceptance?
2385,Cryptocurrencies and blockchain - World Bank Documents
2386,Bitcoin Awareness And Adoption In Singapore Is Huge - Nasdaq
2387,Survey Reveals Shifts In Bitcoin Ownership Demographics
2388,[PDF] BLOCKCHAIN IN AFRICA: - GIZ
2389,How Many People Own Bitcoin? 95 Blockchain Statistics (2022)
2390,Mali | Private Sector | World Bank Development Indicators
2391,Malta crypto ownership numbers
2392,Global Cryptocurrency Ownership Data 2021 - TripleA
2393,Is Malta the domicile of choice for crypto-millionaires?
2394,How Malta's System Is Embracing The Crypto Revolution
2395,Bitcoin ownership among US crypto owners at 81% in March 2021 ...
2396,"[PDF] Crypto-assets - Key developments, regulatory concerns and ..."
2397,Cryptocurrency Regulations Around The World - ComplyAdvantage
2398,[PDF] GLOBAL CRYPTOASSET REGULATORY LANDSCAPE STUDY
2399,10 Cities That Are Bitcoin Hotspots - Investopedia
2400,"Coinbase Global, Inc. - SEC.gov"
2401,Mauritius crypto ownership numbers
2402,Global Cryptocurrency Ownership Data 2021 - TripleA
2403,[PDF] taxation of bitcoin transactions in mauritius: a comparative study with ...
2404,[PDF] Blockchain and Cryptocurrency in Africa - Baker McKenzie
2405,[PDF] Regulation of Cryptocurrency Around the World: November 2021 ...
2406,Cryptocurrency - Developments In Mauritius - Fin Tech - Mondaq
2407,Mauritius Releases Guidance for Regulated Security Token Offerings
2408,Mauritius Home Ownership Rate - 2022 Data - 2023 Forecast
2409,Top ten companies with most bitcoin hold over 204000 in total
2410,Mauritius Trails Peers in Race to Pre-Covid Tourist Numbers
2411,Mexico crypto ownership numbers
2412,Global Cryptocurrency Ownership Data 2021 - TripleA
2413,Finder Cryptocurrency Adoption Index | finder.com
2414,What countries use cryptocurrency the most? | World Economic Forum
2415,Mexico: Virtual Currencies Comparative Guide - Mondaq
2416,[PDF] Cryptocurrency regulations by country - Thomson Reuters
2417,[PDF] The 2020 Geography of Cryptocurrency Report - Gov.bc.ca
2418,"India Tops List Of 27 Nations Surveyed For Crypto Ownership, Says ..."
2419,Cryptocurrency Regulations Around The World - ComplyAdvantage
2420,"Moldova, Republic of crypto ownership numbers"
2421,Global Cryptocurrency Ownership Data 2021 - TripleA
2422,"TripleA - Accept Crypto Payments, Grow Your Business"
2423,(PDF) Blockchain and Bitcoin as a Way to Lift a Country out of Poverty
2424,[PDF] Regulation of Cryptocurrency Around the World: November 2021 ...
2425,Cryptocurrencies - On the cusp of mainstream? - Mercer
2426,Top ten companies with most bitcoin hold over 204000 in total
2427,Is the acceleration of institutional cryptocurrency adoption ...
2428,[PDF] Republic of Moldova 2018 - Flanders Investment and Trade
2429,[PDF] Moneyval-Mutual-Evaluation-Report-Moldova-2019.pdf - FATF
2430,Monaco crypto ownership numbers
2431,Global Cryptocurrency Ownership Data 2021 - TripleA
2432,Crypto Visa card company Monaco just spent millions ... - TechCrunch
2433,Crypto.com - Wikipedia
2434,Cryptos on the rise 2022 | Thomson Reuters
2435,Crypto.com Spent Its Way to the Top. Then the Market Crashed. Now ...
2436,Crypto.com - Crunchbase Company Profile & Funding
2437,Financial Crime Outlook: 2022 and beyond | Monaco | Global law ...
2438,"Monaco Planet, a new generation of SocialFi platform to Launch on ..."
2439,Cryptocurrency Platform Monaco Purchases the Domain Name ...
2440,Mongolia crypto ownership numbers
2441,Mongolia is leading the world in cryptocurrency adoption
2442,[PDF] The 2020 Geography of Cryptocurrency Report - Gov.bc.ca
2443,China's Inner Mongolia to Ban Bitcoin Mining - Decrypt
2444,China's underground bitcoin miners - CNBC
2445,Bitcoin mining is still huge in China despite new ban in Inner Mongolia
2446,Top ten companies with most bitcoin hold over 204000 in total
2447,Opinion: China's bitcoin crackdown is not its final act | IFLR
2448,The Political Geography and Environmental Impacts of ...
2449,Montenegro crypto ownership numbers
2450,Global Cryptocurrency Ownership Data 2021 - TripleA
2451,"In Montenegro, 1,6% of the population owns cryptocurrency"
2452,"Montenegro, the Most Underrated Crypto Jurisdiction"
2453,[PDF] Regulation of Cryptocurrency Around the World: November 2021 ...
2454,Top ten companies with most bitcoin hold over 204000 in total
2455,Crypto License in Montenegro – Get Help from Our Incorporation ...
2456,Vitalik Buterin Becomes a Citizen of Montenegro - DailyCoin
2457,Why criminals can't hide behind Bitcoin | Science | AAAS
2458,Digital 2022 Montenegro (February 2022) v01 - SlideShare
2459,Morocco crypto ownership numbers
2460,The status of cryptocurrency in Morocco - ScienceDirect.com
2461,Morocco tops Arab world in terms of crypto owners followed by Egypt
2462,Morocco is number one for Bitcoin trading in North Africa
2463,A Report Reveals The Number Of Bitcoin Owners In Morocco... And ...
2464,Morocco Remains An African Crypto 'Trading Hub' Despite State Ban
2465,[PDF] Cryptocurrency regulations by country - Thomson Reuters
2466,Crypto stats: Adoption in Saudi; Solana and more! - BitOasis Blog
2467,Saudis come third among Arab cryptocurrency owners
2468,Mozambique crypto ownership numbers
2469,Global Cryptocurrency Ownership Data 2021 - TripleA
2470,INSIGHT-How bitcoin met the real world in Africa | Reuters
2471,Cryptocurrencies and blockchain - World Bank Documents
2472,This map shows where cryptocurrency is taking off around the world
2473,The Role of Market Surveillance: Building Trust in Crypto Markets
2474,How Many People Own Bitcoin? 95 Blockchain Statistics (2022)
2475,"Mozambique acquisition: Latest News & Videos, Photos about ..."
2476,Company Search Page - SEC.gov
2477,EDGAR Full Text Search - SEC.gov
2478,Myanmar crypto ownership numbers
2479,Global Cryptocurrency Ownership Data 2021 - TripleA
2480,Myanmar's NUG looks to cryptocurrencies in bid to raise US$1 ...
2481,Myanmar: Casino Cities Run on Blockchain Threaten Nation's ...
2482,"Crypto, Soros and the Global Drive to Fund Revolution in Myanmar"
2483,Myanmar Planning Digital Currency to Aid Economy - PYMNTS.com
2484,[PDF] Blockchain for digital government - Draft A - ASEAN
2485,Myanmar holds its first blockchain roundtable
2486,The Global Findex Database 2021 - World Bank Group
2487,Why criminals can't hide behind Bitcoin | Science | AAAS
2488,Namibia crypto ownership numbers
2489,Global Cryptocurrency Ownership Data 2021 - TripleA
2490,[PDF] Blockchain and Cryptocurrency in Africa - Baker McKenzie
2491,Crypto-currency adoption in Africa: The ups and downs
2492,For a few cryptos more: the Wild West of crypto finance
2493,Namibian Bitcoin Trading Platform BTN Trudges on Despite Partial ...
2494,Top ten companies with most bitcoin hold over 204000 in total
2495,Why criminals can't hide behind Bitcoin | Science | AAAS
2496,What countries use cryptocurrency the most? | World Economic Forum
2497,2021 Investment Climate Statements: Namibia - Department of State
2498,Nepal crypto ownership numbers
2499,Global Cryptocurrency Ownership Data 2021 - TripleA
2500,Crypto Currency And Its Effect In Nepal | New Spotlight Magazine
2501,Cryptocurrency Statistics 2022: Investing In Crypto - Bankrate.com
2502,[PDF] UNCTAD Policy Brief No. 100
2503,[PDF] Cryptocurrency Regulations: Institutions and Financial Openness
2504,[PDF] Regulation of Cryptocurrency Around the World: November 2021 ...
2505,For a few cryptos more: the Wild West of crypto finance
2506,Bitcoin ban: These are the countries where crypto is restricted or illegal
2507,"Crypto and the Dollar Are Partners, Not Rivals - Bloomberg.com"
2508,Netherlands crypto ownership numbers
2509,"Netherlands: ownership of cryptocurrencies, by type 2018 - Statista"
2510,"Netherlands: ownership of cryptocurrencies, by gender 2018 - Statista"
2511,Travel Rule Crypto in Netherlands by DNB [2021] - Notabene
2512,Dutch regulators unsure of number of crypto investors in Netherlands
2513,Cryptos on the rise 2022 | Thomson Reuters
2514,How Many People Own Bitcoin? 95 Blockchain Statistics (2022)
2515,Why criminals can't hide behind Bitcoin | Science | AAAS
2516,Crypto countries: Tracking global interest in cryptocurrencies
2517,New Caledonia crypto ownership numbers
2518,New Caledonia Home Ownership Rate - 2022 Data - 2023 Forecast
2519,Global Cryptocurrency Ownership Data 2021 - TripleA
