,0
427,"One month on, El Salvador's bitcoin use grows but headaches persist"
428,El Salvador endures bumpy first week with bitcoin as legal tender
429,El Salvador becomes a crypto laboratory with bitcoin gamble
430,Why El Salvador's Bitcoin embrace worked for these merchants
431,Estonia crypto ownership numbers
432,Global Cryptocurrency Ownership Data 2021 - TripleA
433,"Once a Crypto Trailblazer, Estonia Is Cracking Down on Risk"
434,[PDF] Cryptocurrency regulations by country - Thomson Reuters
435,[PDF] Estonian FIU's Survey of Service Providers of Virtual Currency
436,Estonia cryptocurrency exchange license - crypto license in Estonia ...
437,Cryptocurrency Regulations Around The World - ComplyAdvantage
438,How will new Estonian draft legislation affect virtual assets and crypto?
439,As many as 1 in 10 European households could own crypto
440,Ethiopia crypto ownership numbers
441,Ethiopia Ranked 7th in Top 10 Cryptocurrency Holders List of Africa ...
442,Global Cryptocurrency Ownership Data 2021 - TripleA
443,Ethiopians Creeping Into Crypto
444,Ethiopia's blockchain deal is a watershed moment - Down To Earth
445,[PDF] The 2020 Geography of Cryptocurrency Report - Gov.bc.ca
446,[PDF] Blockchain and Cryptocurrency in Africa - Baker McKenzie
447,INSIGHT-How bitcoin met the real world in Africa | Reuters
448,[PDF] Cryptocurrency Regulations: Institutions and Financial Openness
449,Renewed Hope: How Bitcoin And Green Energy Can Save ... - Forbes
450,Fiji crypto ownership numbers
451,Global Cryptocurrency Ownership Data 2021 - TripleA
452,[PDF] The 2020 Geography of Cryptocurrency Report - Gov.bc.ca
453,[PDF] PRESS RELEASE - Fiji Financial Intelligence Unit
454,Bitcoin paradise? Briton creates 'crypto utopia' in South Pacific
455,Crypto millionaires building their own cities in Central America
456,Top ten companies with most bitcoin hold over 204000 in total
457,Why criminals can't hide behind Bitcoin | Science | AAAS
458,Cryptocurrencies and blockchain - World Bank Documents
459,The Business Benefit of Using Cryptocurrency | Deloitte US
460,Finland crypto ownership numbers
461,Global Cryptocurrency Ownership Data 2021 - TripleA
462,Cryptocurrency adoption by country 2019-2021 - Statista
463,[PDF] Cryptocurrency regulations by country - Thomson Reuters
464,[PDF] Compendium – Cryptocurrency regulations by country
465,Cryptocurrency Concerns vs Regulations in Europe - CoinShares
466,[PDF] Crypto-Assets Activity around the World
467,75 Cryptocurrency Statistics Show Crypto's Gone Mainstream
468,"44 Cryptocurrency Stats: History, market, adoption, users& crimes"
469,[PDF] Crypto: A New Asset Class? - Goldman Sachs
470,France crypto ownership numbers
471,Cryptocurrency Ownership Data for France 2021 - TripleA
472,Cryptocurrency Regulation in France: Updated Guide (June 2021)
473,As many as 1 in 10 European households could own crypto
474,Cryptos on the rise 2022 | Thomson Reuters
475,Towards a new regime for crypto-assets in France | AMF
476,Crypto adoption in Europe lags behind most of the world - Euronews
477,30% of the French plan to invest in cryptocurrencies | Ipsos
478,For a few cryptos more: the Wild West of crypto finance
479,French Polynesia crypto ownership numbers
480,Global Cryptocurrency Ownership Data 2021 - TripleA
481,Cryptocurrency Ownership Data for France 2021 - TripleA
482,Top ten companies with most bitcoin hold over 204000 in total
483,Does your French intellectual property right extend to ... - AJ Park
484,Why criminals can't hide behind Bitcoin | Science | AAAS
485,How Jack Dorsey Quit Twitter to Become Bitcoin's Spiritual Leader
486,Spatial analysis of global Bitcoin mining | Scientific Reports - Nature
487,PICS: 3-Day Summit to Make Polynesia the Beating Heart of the ...
488,Cryptocurrency - Nasdaq
489,Gabon crypto ownership numbers
490,Global Cryptocurrency Ownership Data 2021 - TripleA
491,[PDF] Blockchain and Cryptocurrency in Africa - Baker McKenzie
492,INSIGHT-How bitcoin met the real world in Africa | Reuters
493,Cryptocurrencies and blockchain - World Bank Documents
494,Why criminals can't hide behind Bitcoin | Science | AAAS
495,Top ten companies with most bitcoin hold over 204000 in total
496,World's Biggest Ever Carbon Credits Issue Planned in Gabon
497,"Regulation of cryptocurrency around the world Albania, Algeria ..."
498,[PDF] BLOCKCHAIN IN AFRICA: - GIZ
499,Georgia crypto ownership numbers
500,Georgia Ranks 29th Globally by Cryptocurrency Owners - BM.GE
501,Have Georgia's crypto glory days passed? - Eurasianet
502,"Former Soviet Republic Is Primed For Crypto Mining, Despite Its ..."
503,How Many People Own Bitcoin? 95 Blockchain Statistics (2022)
504,How The Tiny Nation Of Georgia Became A Bitcoin Behemoth - NPR
505,[PDF] Digital Transformation: Blockchain and Land Titles - OECD
506,Cryptocurrency in Georgia & Tbilisi | 0% Tax | Easy Exchange
507,The Bitcoin Whales: 1000 People Who Own 40 Percent of the Market
508,Germany crypto ownership numbers
509,Almost half of Germans to invest in crypto: Report - Cointelegraph
510,What was most popular cryptocurrency in Germany in 2021?
511,"Cryptocurrency ownership in Germany in 2020, by age - Statista"
512,"Cryptocurrency ownership in Germany in 2020, by gender - Statista"
513,Cryptos on the rise 2022 | Thomson Reuters
514,Crypto week at a glance: Bitcoin slips below $30000; Germany ...
515,Travel Rule Crypto in Germany by BaFin [2021] - Notabene
516,Finder Cryptocurrency Adoption Index - Singapore
517,Ghana crypto ownership numbers
518,Ghana has the 9th highest rate for cryptocurrency ownership out of ...
519,Bank of Ghana on digital currency; Crypto ownership for 2021
520,Financial product or service ownership in Ghana 2021 - Statista
521,2021 Global Crypto Adoption Index Up 880% - Chainalysis Blog
522,Ghana Ranks High As A Crypto Ownership Location - NewsDio.com
523,Blockchain for sustainable development: The case of Ghana
524,[PDF] Digital Transformation: Blockchain and Land Titles - OECD
525,Ghana - GovChain
526,Greece crypto ownership numbers
527,Global Cryptocurrency Ownership Data 2021 - TripleA
528,What countries use cryptocurrency the most? | World Economic Forum
529,[PDF] Cryptocurrency regulations by country - Thomson Reuters
530,Cryptos on the rise 2022 | Thomson Reuters
531,Best Crypto Exchanges in Greece for July 2022
532,[PDF] Crypto-Assets Activity around the World
533,Chart: How Common is Crypto? - Statista
534,[PDF] Regulation of Cryptocurrency Around the World: November 2021 ...
535,[PDF] EU Blockchain Ecosystem developments
536,Guatemala crypto ownership numbers
537,Global Cryptocurrency Ownership Data 2021 - TripleA
538,Crypto millionaires building their own cities in Central America
539,Chinese investors flock to the 'wild west in crypto' - Financial Times
540,"Central banks of Honduras, Guatemala eye digital currencies as El ..."
541,Facebook scales back its crypto ambitions once again - TechCrunch
542,Why criminals can't hide behind Bitcoin | Science | AAAS
543,Corporates investing in crypto | Deloitte US
544,Bitcoin Believers Look for New Paradise at Mayan Lake - El Faro
545,Cryptocurrencies and blockchain - World Bank Documents
546,Guyana crypto ownership numbers
547,Global Cryptocurrency Ownership Data 2021 - TripleA
548,Future Of Bitcoin Trading In Guyana - The Freeman Online
549,[PDF] Cryptocurrency Regulations: Institutions and Financial Openness
550,Why criminals can't hide behind Bitcoin | Science | AAAS
551,Digital 2021 Guyana (January 2021) v01 - SlideShare
552,The Business Benefit of Using Cryptocurrency | Deloitte US
553,Guyana: gross national income per capita 2011-2020 - Statista
554,Accounting for cryptocurrencies - ACCA Global
555,EY Guyana - Home | Building a better working world
556,Haití crypto ownership numbers
557,Global Cryptocurrency Ownership Data 2021 - TripleA
558,Cryptocurrency Ownership Data for Egypt 2021 - TripleA
559,[PDF] Cryptocurrency Regulations: Institutions and Financial Openness
560,Why criminals can't hide behind Bitcoin | Science | AAAS
561,INSIGHT-How bitcoin met the real world in Africa | Reuters
562,Wall Street Asks If Bitcoin Can Ever Replace Fiat Currencies
563,Paying With Bitcoin in World Crypto Capital El Salvador is Infuriating
564,Top ten companies with most bitcoin hold over 204000 in total
565,Cryptocurrencies and blockchain - World Bank Documents
566,Honduras crypto ownership numbers
567,Global Cryptocurrency Ownership Data 2021 - TripleA
568,Crypto millionaires building their own cities in Central America
569,'Bitcoin Valley' Launches in Honduras — 60 Businesses Accept BTC ...
570,Bitcoin fever reaches Honduras with first cryptocurrency ATM
571,Honduras launches 'Bitcoin Valley' in the tourist town of Santa Lucia
572,[PDF] Digital Transformation: Blockchain and Land Titles - OECD
573,New 'Bitcoin Hub' Opens in Honduras - The BTC Times
574,Honduras Welcomes Tourists To Bitcoin Valley In Santa Lucia
575,Bitcoin Valley' Launches in Honduras — 60 Businesses Accept BTC ...
576,Hong Kong crypto ownership numbers
577,Hongkongers are among the world's biggest investors in ...
578,Finder Cryptocurrency Adoption Index - | Finder Hong Kong
579,[PDF] Discussion Paper on Crypto-assets and Stablecoins
580,Visa Study: Consumers in Hong Kong see crypto as the financial ...
581,New crypto owners nearly doubled in 3 key regions in 2021: Report
582,Cryptos on the rise 2022 | Thomson Reuters
583,Why Hong Kong's crypto crown is slipping - Financial Times
584,"Crypto Scams in Hong Kong and Points to Note | Oldham, Li & Nie"
585,Global crypto awareness: Singapore beats Canada and Hong Kong
586,Hungary crypto ownership numbers
587,Cryptocurrency usage in Hungary 2021 - Statista
588,[PDF] Cryptocurrency regulations by country - Thomson Reuters
589,Cryptos on the rise 2022 | Thomson Reuters
590,Cryptocurrency Regulations in Hungary - Gurcan Partners Law Firm
591,Hungary Plans to Cut Taxes On Bitcoin In Half - Nasdaq
592,Five arrests in Hungary for money laundering across three continents
593,Hungary Bends to EU Demands as Forint Woes Add Urgency for ...
594,[PDF] The Opinion of the Hungarian National Authority for Data Protection ...
595,Iceland crypto ownership numbers
596,Global Cryptocurrency Ownership Data 2021 - TripleA
597,Largest Bitcoin Mining Farms in the World | Sunbird DCIM
598,Iceland's Big Bitcoin Heist | Vanity Fair
599,Bitcoin mining: Is Scandinavia's cryptoboom coming to an end? - DW
600,Russia Values Local Crypto at $200 Billion as Rules Near
601,"Bitcoin mini-mining rig costs $875, lets owner mine from Starbucks"
602,Cryptocurrencies - On the cusp of mainstream? - Mercer
603,Top ten companies with most bitcoin hold over 204000 in total
604,Bitcoin Mining Uses More Energy Than Homes Do in Iceland - Fortune
605,India crypto ownership numbers
606,Cryptocurrency Ownership Data for India 2021 - TripleA
607,India has highest number of crypto owners in the world at 10.07 crore
608,Cryptocurrency adoption index and patterns in India: Finder's report ...
609,"India has more than 10 crore crypto owners now, highest in the world"
610,India Tops The List Of Crypto Ownership With 100 Million Hodlers ...
611,Finder Cryptocurrency Adoption Index - finder India
612,"India has world's largest number of crypto owners, most under 35"
613,India Has Highest Number of Cryptocurrency Owners in the World at ...
614,Why estimates of India's crypto-owning population could be ...
615,Indonesia crypto ownership numbers
616,Indonesia Enjoys The Highest Crypto Adoption Rate Worldwide: Study
617,Indonesia's crypto industry in 2021: A kaleidoscope - Cointelegraph
618,Over 6.5 million Indonesians bought or sold crypto in first 5 ... - KrASIA
619,A Simple Guide to Trading Cryptocurrency in Indonesia
620,Finder Cryptocurrency Adoption Index - finder Indonesia
621,Indonesia's Growing Crypto Industry
622,11% of Indonesians own cryptocurrency - Asia Times
623,Indonesian Crypto Industry in 2021: A Kaleidoscope - LinkedIn
624,Indonesia and Brazil lead the world among cryptocurrency investors
625,Iran crypto ownership numbers
626,"Up to 12 Million Iranians Own Cryptocurrency, Traders Choose ..."
627,Global Cryptocurrency Ownership Data 2021 - TripleA
628,How Iran Uses Bitcoin Mining to Evade Sanctions - Elliptic
629,Cryptos on the rise 2022 | Thomson Reuters
630,[PDF] The 2020 Geography of Cryptocurrency Report - Gov.bc.ca
631,Inside Iran's Onslaught on Bitcoin Mining - CoinDesk
632,Iran: Majlis Enters the Crypto Fray - Financial Tribune
633,Bitcoin ban: These are the countries where crypto is restricted or illegal
634,Top ten companies with most bitcoin hold over 204000 in total
635,New Figures Show Huge Surge In Iran's Cryptocurrency Mining
636,Iraq crypto ownership numbers
637,Global Cryptocurrency Ownership Data 2021 - TripleA
638,[PDF] Regulation of Cryptocurrency Around the World: November 2021 ...
639,10 Cities That Are Bitcoin Hotspots - Investopedia
640,Bitcoin ban: These are the countries where crypto is restricted or illegal
641,The Inevitability of Crypto in Iraq | Abdurrahman Bapir - CoinDesk
642,Crypto is fully banned in China and 8 other countries - Fortune
643,"Global Crypto Users Can Reach 1 Billion by December 2022, says ..."
644,Iraq's financial inclusion drive boosted by homegrown fintech
645,75 Cryptocurrency Statistics Show Crypto's Gone Mainstream
646,Ireland crypto ownership numbers
647,Ireland Named 6th Most 'Crypto-ready' Country in the World
648,Global Cryptocurrency Ownership Data 2021 - TripleA
649,Most cryptocurrency owners are in their 20s and 30s - Independent.ie
650,Cryptocurrencies and crypto-assets - Revenue
651,Crypto adoption in Europe lags behind most of the world - Euronews
652,Cryptos on the rise 2022 | Thomson Reuters
653,[PDF] Cryptocurrency regulations by country - Thomson Reuters
654,Singapore is the world's top crypto country in latest world ... - ZDNet
655,Israel crypto ownership numbers
656,Report: One third of Israelis and Emiratis own cryptocurrency
657,[PDF] Blockchain for SMEs and entrepreneurs in Israel - OECD
658,Survey Shows Crypto Usage in the Middle East on the Rise
659,Welcome to the Crypto Age | Israel Innovation
660,New crypto owners nearly doubled in 3 key regions in 2021: Report
661,[PDF] Cryptocurrency regulations by country - Thomson Reuters
662,Cryptos on the rise 2022 | Thomson Reuters
663,10 Cities That Are Bitcoin Hotspots - Investopedia
664,Italy crypto ownership numbers
665,Ownership of cryptocurrency in Italy 2018 - Statista
666,Bitcoin investments among users of Italy's GimmeLike 2021 - Statista
667,Italy Crypto Adoption Statistics— Data Shows Surging Interest
668,[PDF] Blockchain for SMEs and entrepreneurs in Italy - OECD
669,Blockchain & Cryptocurrency Laws and Regulations | Italy | GLI
670,Cryptocurrency Concerns vs Regulations in Europe - CoinShares
671,[PDF] Cryptocurrency adoption rates - Finder - 3 Bit Lab
672,[PDF] Cryptocurrency regulations by country - Thomson Reuters
673,Ivory Coast crypto ownership numbers
674,Global Cryptocurrency Ownership Data 2021 - TripleA
675,INSIGHT-How bitcoin met the real world in Africa | Reuters
676,Crypto's Greatest Challenge: Legitimacy or Acceptance?
677,Cryptocurrency: The 'Afro' struggles to become the bitcoin of Africa
678,"Ivory Coast, Ghana to raise cocoa origin differentials in August"
679,How Many People Own Bitcoin? 95 Blockchain Statistics (2022)
680,Bitcoin ownership is on the rise in Canada | Ipsos
681,Figure of the week: The rapidly increasing role of cryptocurrencies in ...
682,Ivory Coast Gets Profile Boost as Eni Discovers More Oil and Gas
683,Jamaica crypto ownership numbers
684,Global Cryptocurrency Ownership Data 2021 - TripleA
685,Jamaica Offers Free Money to Digital Currency's First Adopters
686,"'No Cash, No Problem': Jamaica Picks Tagline for New E-Currency"
687,Today in Crypto: Jamaica Incentivizes New Users | PYMNTS.com
688,Top ten companies with most bitcoin hold over 204000 in total
689,Why criminals can't hide behind Bitcoin | Science | AAAS
690,Cryptocurrencies and Digital money - DW Observatory
691,Cryptocurrencies and blockchain - World Bank Documents
692,"Cryptocurrency attracting Black, Latino investors and fans - ABC News"
693,Japan crypto ownership numbers
694,Number of crypto asset accounts in Japan 2018-2021 - Statista
695,Global Cryptocurrency Ownership Data 2021 - TripleA
696,Japan's cryptocurrency market: Set to bloom or wither?
697,Japan a global leader in cryptocurrency investment
698,What countries use cryptocurrency the most? | World Economic Forum
699,How Many People Own Bitcoin? 95 Blockchain Statistics (2022)
700,Blockchain & Cryptocurrency Laws and Regulations | Japan | GLI
701,[PDF] Cryptocurrency regulations by country - Thomson Reuters
702,Jordan crypto ownership numbers
703,"63+ Cryptocurrency Statistics, Facts & Trends - Buy Bitcoin Worldwide"
704,Global Cryptocurrency Ownership Data 2021 - TripleA
705,15 Essential Cryptocurrency Stats for 2022 - Influencer Marketing Hub
706,Russia Values Local Crypto at $200 Billion as Rules Near
707,10 Cities That Are Bitcoin Hotspots - Investopedia
708,INSIGHT-How bitcoin met the real world in Africa | Reuters
709,How Many People Own Bitcoin? 95 Blockchain Statistics (2022)
710,Legality of cryptocurrency by country or territory - Wikipedia
711,Inside the Jordan refugee camp that runs on blockchain
712,Kazakhstan crypto ownership numbers
713,Global Cryptocurrency Ownership Data 2021 - TripleA
714,"Even in Kazakhstan, Bitcoin Can't Escape Geopolitics - JSTOR Daily"
715,Kazakhstan and Cryptocurrency - Freeman Law
716,Kazakh Ministers Suggest Tenfold Increase In Cryptocurrency Tax
717,Crypto miners in Kazakhstan face bitter winter of power cuts
718,Crypto miners to file quarterly reports with Kazakhstan authorities
719,Why Kazakhstan is attracting bitcoin miners - Asia Times
720,Kazakhstan's bitcoin 'paradise' may be losing its lustre
721,The legal regulations and perspectives of cryptocurrency in ...
722,Bitcoin network power slumps as Kazakhstan crackdown hits crypto ...
723,Kenya crypto ownership numbers
724,"4.2 million Kenyans own crypto, highest in Africa – report - Technext"
725,Kenya Has Highest Proportion of Crypto Owning Citizens in Africa ...
726,Kenyan crypto traders trying to 'buy the dip' got burned - Quartz
727,Blockchain & Cryptocurrency Laws and Regulations | Kenya | GLI
728,Crypto countries: Tracking global interest in cryptocurrencies
729,This map shows where cryptocurrency is taking off around the world
730,2021 Global Crypto Adoption Index Up 880% - Chainalysis Blog
731,[PDF] Blockchain and Cryptocurrency in Africa - Baker McKenzie
732,Kuwait crypto ownership numbers
733,Global Cryptocurrency Ownership Data 2021 - TripleA
734,Morocco tops Arab world in terms of crypto owners followed by Egypt
735,[PDF] The 2020 Geography of Cryptocurrency Report - Gov.bc.ca
736,Best Crypto Exchange in Kuwait for July 2022 - Business 2 Community
737,KWSEPM:IND Boursa Kuwait Premier Market Price Return Index
738,30 Brand New Cryptocurrency Statistics for 2022 - Exploding Topics
739,Top ten companies with most bitcoin hold over 204000 in total
740,[PDF] Regulation of Cryptocurrency Around the World: November 2021 ...
741,"Cryptocurrency - data, statistics and visualizations - knoema.com"
742,Kyrgyzstan crypto ownership numbers
743,Global Cryptocurrency Ownership Data 2021 - TripleA
744,The Present and Future of Crypto Mining in Kyrgyzstan amid Energy ...
745,Chain and silk: alternative futures of blockchain governance in ...
746,"The9 Limited and SolarCoin, a Kyrgyzstan Cryptomining Company ..."
747,Legality of cryptocurrency by country or territory - Wikipedia
748,[PDF] Regulation of Cryptocurrency Around the World: November 2021 ...
749,National market structure – Kyrgyzstan energy profile – Analysis - IEA
750,[PDF] Tax and Investment Guide Kyrgyz Republic - Deloitte
751,(PDF) Chain and silk: alternative futures of blockchain governance ...
752,Laos crypto ownership numbers
753,Global Cryptocurrency Ownership Data 2021 - TripleA
754,Laos pushes into crypto as it authorises mining and trading
755,Asian Nation Laos to Legalize Bitcoin Mining And Trading - Nasdaq
756,"The LAO: A For-Profit, Limited Liability Autonomous Organization"
757,[PDF] Enhancing capacities on digital G2P and G2B transfers ... - ESCAP
758,Warnings of Sovereign Defaults in Asia Frontier Markets Flare Up
759,Digital 2021 Laos (January 2021) v01 - SlideShare
760,"As Laos rolls out welcome mat for crypto mining, big questions ..."
761,Why criminals can't hide behind Bitcoin | Science | AAAS
762,Latvia crypto ownership numbers
763,Global Cryptocurrency Ownership Data 2021 - TripleA
764,[PDF] Cryptocurrency regulations by country - Thomson Reuters
765,[PDF] Compendium – Cryptocurrency regulations by country
766,[PDF] EU Blockchain Ecosystem developments
767,Crypto-assets in Latvia: first steps in evaluation - Macroeconomics.lv
768,[PDF] Cryptocurrencies: An empirical view from a tax perspective
769,5 things to know about Blockchain in Latvia / Article - LSM.LV
770,75 Cryptocurrency Statistics Show Crypto's Gone Mainstream
771,Lebanon crypto ownership numbers
772,The crypto dons of Beirut - Rest of World
773,Lebanese turn to cryptocurrency as economy tanks - Al-Monitor
774,"In Lebanon, bitcoin is proving to be a safe bet | Middle East Eye"
775,Bitcoin in Beirut: Cryptocurrency Adoption in the Face of Financial ...
776,Why Bitcoin Should Be The Saving Choice of Lebanon | Nasdaq
777,How refugees in Lebanon can benefit from cryptocurrencies to ...
778,FEATURE-Young Lebanese driving crypto 'revolution' after banks go ...
779,Morocco tops Arab world in terms of crypto owners followed by Egypt
780,Libya crypto ownership numbers
781,Global Cryptocurrency Ownership Data 2021 - TripleA
782,[PDF] Libya Financial Sector Review - Pubdocs.worldbank.org.
783,INSIGHT-How bitcoin met the real world in Africa | Reuters
784,Libya and Cryptocurrency - Freeman Law
785,The intelligence coup of the century - The Washington Post
786,Libya Nation Ownership - DeNations | OpenSea
787,"Japan's Startup Push May Take Decades to Work, Entrepreneur Says"
788,Libya Shuts Down Another 200000 Barrels a Day of Oil Production
789,"Libya - Start-up Procedures To Register A Business, Female - 2022 ..."
790,Lithuania crypto ownership numbers
791,Global Cryptocurrency Ownership Data 2021 - TripleA
792,Lithuania Cryptocurrency Regulation 2022 - Crypto License
793,[PDF] Lithuania's ICO Guidelines
794,[PDF] Cryptocurrency regulations by country - Thomson Reuters
795,[PDF] Compendium – Cryptocurrency regulations by country
796,Cryptocurrency fever persists in Lithuania: the number of the ...
797,Lithuania Crypto License - Costs and Requirements | Money Gate
798,"lithuania cryptocurrency, lithuania crypto exchange license"
799,Luxembourg crypto ownership numbers
800,"Cryptocurrency ownership in Luxembourg in 2018, by type - Statista"
801,Familiarity in Luxembourg with cryptocurrency in 2018 - Statista
802,Global Cryptocurrency Ownership Data 2021 - TripleA
803,[PDF] Crypto-assets: Paradigm shift or short-term trend? - PwC Luxembourg
804,Cryptocurrency Regulations Around The World - ComplyAdvantage
805,Cryptocurrency Concerns vs Regulations in Europe - CoinShares
806,Blockchain means we've already passed 'peak fund' - Schroders
807,[PDF] Cryptocurrencies: Tracing the Evolution of Criminal Finances - Europol
808,"[PDF] Crypto-assets - Key developments, regulatory concerns and ..."
809,Macao crypto ownership numbers
810,Global Cryptocurrency Ownership Data 2021 - TripleA
811,Hongkongers are among the world's biggest investors in ...
812,Macau Covid News: City to Reopen With Casino Revenue at Record ...
813,"One in 10 eurozone households own cryptoassets, says ECB |"
814,Blockchain.com wallets 2011-2022 - Statista
815,"[PDF] Macao, China - FATF"
816,Opinion: China's bitcoin crackdown is not its final act | IFLR
817,Bitcoin Awareness And Adoption In Singapore Is Huge - Nasdaq
818,[PDF] The 2020 Geography of Cryptocurrency Report - Gov.bc.ca
819,Madagascar crypto ownership numbers
820,Global Cryptocurrency Ownership Data 2021 - TripleA
821,INSIGHT-How bitcoin met the real world in Africa | Reuters
822,The rise of crypto adoption in Africa - International Finance Magazine
823,Why criminals can't hide behind Bitcoin | Science | AAAS
824,Madagascar and Cryptocurrency - Freeman Law
825,Why famine in Madagascar is an alarm bell for the planet
826,2019 Investment Climate Statements: Madagascar - State Department
827,Madagascar Car Registrations - July 2022 Data - 2011-2021 Historical
828,The Business Benefit of Using Cryptocurrency | Deloitte US
829,Malawi crypto ownership numbers
830,Global Cryptocurrency Ownership Data 2021 - TripleA
831,THE EXTENT OF CRYPTOCURRENCIES IN MALAWI Prepared for ...
832,Crypto-currency adoption in Africa: The ups and downs
833,Building Ethereum Dapps: Decentralized applications on the ...
834,INSIGHT-How bitcoin met the real world in Africa | Reuters
835,How to Buy Bitcoin in Malawi with Kwacha Instantly - Yellow Card
836,Crypto millionaires building their own cities in Central America
837,The Bitcoin Whales: 1000 People Who Own 40 Percent of the Market
838,This map shows where cryptocurrency is taking off around the world
839,Malaysia crypto ownership numbers
840,Crypto Ownership Data for Malaysia 2021 - TripleA
841,Malaysia's crypto scene is booming. What are the risks?
842,"Cryptocurrency ownership in Nigeria, Malaysia highest in the world"
843,Malaysia is well placed to become a regional crypto hub - Capital.com
844,Malaysians Into Crypto - DailyStraits.com
845,Cryptocurrency adoption by country 2019-2021 - Statista
846,Global crypto users could reach one billion by end of 2022
847,Malaysia's crypto scene a goldmine for scammers
848,Malaysia is ambivalent about crypto - Kapronasia
849,Maldives crypto ownership numbers
850,Global Cryptocurrency Ownership Data 2021 - TripleA
851,Cryptocurrencies and blockchain - World Bank Documents
