,0
3348,Cryptocurrency Regulations Around The World - ComplyAdvantage
3349,[PDF] The 2020 Geography of Cryptocurrency Report - Gov.bc.ca
3350,"In Latin America, Crypto Owners Can Buy Real Estate Using Bitcoin ..."
3351,For a few cryptos more: the Wild West of crypto finance
3352,[PDF] Chapter 2: The Crypto Ecosystem and Financial Stability Challenges
3353,China crypto ownership numbers
3354,Number of registered blockchain companies in China 2014-2020
3355,Crypto Ownership Data for Hong Kong 2021 - TripleA
3356,China Crypto Investors Are Buying More as Beijing Circles
3357,Chinese investors flock to the 'wild west in crypto' - Financial Times
3358,Chinese cryptocurrency traders look for ways around ban
3359,2021 Global Crypto Adoption Index Up 880% - Chainalysis Blog
3360,China declares all crypto-currency transactions illegal - BBC News
3361,This map shows where cryptocurrency is taking off around the world
3362,Colombia crypto ownership numbers
3363,Global Cryptocurrency Ownership Data 2021 - TripleA
3364,Colombia: cryptocurrency interest of millennials - Statista
3365,Colombia: cryptocurrency traders by gender 2021 - Statista
3366,What countries use cryptocurrency the most? | World Economic Forum
3367,This map shows where cryptocurrency is taking off around the world
3368,How Many People Own Bitcoin? 95 Blockchain Statistics (2022)
3369,"2022, the year of the crypto economy in Latin America - RSM Global"
3370,[PDF] Cryptocurrency regulations by country - Thomson Reuters
3371,Costa Rica crypto ownership numbers
3372,Global Cryptocurrency Ownership Data 2021 - TripleA
3373,Crypto millionaires building their own cities in Central America
3374,Cryptocurrency in Costa Rica | Remax Ocean Surf & Sun
3375,[PDF] Regulation of Cryptocurrency Around the World: November 2021 ...
3376,Costa Rica and Cryptocurrency - Freeman Law
3377,World's Biggest Bitcoin Experiment Is a Surf Town in El Salvador
3378,Paying With Bitcoin in World Crypto Capital El Salvador is Infuriating
3379,[PDF] Cryptocurrency Regulations: Institutions and Financial Openness
3380,The Complete Guide to Cryptocurrency Statistics for August 2022
3381,Croatia crypto ownership numbers
3382,Global Cryptocurrency Ownership Data 2021 - TripleA
3383,Guide to cryptocurrency in Croatia
3384,Cryptocurrency License in Croatia | Law&Trust International
3385,How to buy bitcoin in Croatia - Itez.com instruction
3386,Tax Treatment of Crypto Currency in Croatia - LinkedIn
3387,Croatian Post Is Helping Croatians Convert Bitcoin To Kuna - Bitcoinist
3388,[PDF] EU Blockchain Ecosystem developments
3389,Crypto market in Croatia: Why is Bitcoin not widely talked about after ...
3390,Best crypto exchange in Croatia August 2022 - Business 2 Community
3391,Cuba crypto ownership numbers
3392,"In Cuba, cryptocurrency gains momentum - NBC News"
3393,You Would Understand Bitcoin if You Were Under Cuba's Embargo
3394,"Mark Cuban on his crypto portfolio: I own Ethereum, ether, and bitcoin"
3395,Global Cryptocurrency Ownership Data 2021 - TripleA
3396,Cuba and Cryptocurrency - Freeman Law
3397,Cuba to Dole Out Crypto Licenses Amid Continued U.S. Sanctions
3398,"In Cuba, cryptocurrency gains momentum - Yahoo News"
3399,"Cuba approves cryptocurrency services, requires central bank license"
3400,100000 Cubans Are Using Cryptocurrencies to Bypass Financial ...
3401,Here's What Mark Cuban Said About the Recent Crypto Crash
3402,Cyprus crypto ownership numbers
3403,Global Cryptocurrency Ownership Data 2021 - TripleA
3404,Crypto assets in corporate insolvency in Cyprus - IFLR
3405,Blockchain & Cryptocurrency Laws and Regulations | Cyprus | GLI
3406,CRYPTO ASSET SERVICES PROVIDERS (CASP)
3407,Cyprus introduces first steps towards Crypto-Asset regulation ...
3408,The novel registration of Crypto-Assets Service Providers in Cyprus
3409,Crypto countries: Tracking global interest in cryptocurrencies
3410,How to Buy Property with Cryptocurrency in Cyprus - Lexology
3411,10 Cities That Are Bitcoin Hotspots - Investopedia
3412,Czech Republic crypto ownership numbers
3413,Global Cryptocurrency Ownership Data 2021 - TripleA
3414,"Evolution, trading and security issues about cryptocurrencies on the ..."
3415,Annual cryptocurrency trading volume in Czechia 2019-2021 - Statista
3416,[PDF] Cryptocurrency regulations by country - Thomson Reuters
3417,Cryptos on the rise 2022 | Thomson Reuters
3418,Guidance issued on the VAT treatment of cryptocurrency transactions
3419,Tax and Legal News - February 2022 | EY - Czech Republic
3420,[PDF] EU Blockchain Ecosystem developments
3421,"Crypto Collapse Threatens to Leave Black, Hispanic Investors ..."
3422,Democratic Republic of Congo crypto ownership numbers
3423,Global Cryptocurrency Ownership Data 2021 - TripleA
3424,[PDF] Blockchain and Cryptocurrency in Africa - Baker McKenzie
3425,INSIGHT-How bitcoin met the real world in Africa | Reuters
3426,China Cash Flowed Through Congo Bank to Former President's ...
3427,Cryptocurrencies - On the cusp of mainstream? - Mercer
3428,The Global Findex Database 2021 - World Bank Group
3429,Top ten companies with most bitcoin hold over 204000 in total
3430,Why criminals can't hide behind Bitcoin | Science | AAAS
3431,The Business Benefit of Using Cryptocurrency | Deloitte US
3432,Denmark crypto ownership numbers
3433,Global Cryptocurrency Ownership Data 2021 - TripleA
3434,Cryptocurrencies (Bitcoins etc.) - Skat.dk
3435,What countries use cryptocurrency the most? | World Economic Forum
3436,[PDF] Cryptocurrency regulations by country - Thomson Reuters
3437,Denmark's Tax Authority Sends Warning Letters to 20000 Crypto ...
3438,Crypto adoption in Europe lags behind most of the world - Euronews
3439,Singapore is the world's top crypto country in latest world ... - ZDNet
3440,[PDF] Central Bank Digital Currency in Denmark? - Danmarks Nationalbank
3441,Cryptocurrency Concerns vs Regulations in Europe - CoinShares
3442,Dominican Republic crypto ownership numbers
3443,Global Cryptocurrency Ownership Data 2021 - TripleA
3444,Countries where cryptocurrencies are not prohibited
3445,Cryptocurrency Statistics 2022: Investing In Crypto - Bankrate.com
3446,Dominican Republic and Cryptocurrency - Freeman Law
3447,[PDF] Crypto-Assets Activity around the World
3448,[PDF] Cryptocurrency Regulations: Institutions and Financial Openness
3449,[PDF] Regulation of Crypto Assets - International Monetary Fund
3450,Why criminals can't hide behind Bitcoin | Science | AAAS
3451,India's proposed Crypto tax - Avalara
3452,Ecuador crypto ownership numbers
3453,Global Cryptocurrency Ownership Data 2021 - TripleA
3454,How Many People Own Bitcoin? 95 Blockchain Statistics (2022)
3455,[PDF] Cryptocurrency regulations by country - Thomson Reuters
3456,Cryptos on the rise 2022 | Thomson Reuters
3457,Crypto millionaires building their own cities in Central America
3458,Ecuador becomes the first country to roll out its own digital cash
3459,"63+ Cryptocurrency Statistics, Facts & Trends - Buy Bitcoin Worldwide"
3460,World's Biggest Bitcoin Experiment Is a Surf Town in El Salvador
3461,Egypt crypto ownership numbers
3462,Global Cryptocurrency Ownership Data 2021 - TripleA
3463,Morocco tops Arab world in terms of crypto owners followed by Egypt
3464,Crypto stats: Adoption in Saudi; Solana and more! - BitOasis Blog
3465,Inside Egypt's cryptocurrency market - EgyptToday
3466,Saudis come third among Arab cryptocurrency owners
3467,Bitcoin (BTC) trading volume in 44 countries worldwide in 2020
3468,[PDF] Cryptocurrency regulations by country - Thomson Reuters
3469,Cryptos on the rise 2022 | Thomson Reuters
3470,El Salvador crypto ownership numbers
3471,Bitcoin in El Salvador - statistics & facts - Statista
3472,"El Salvador Buys Bitcoin Dip, Adding 500 Coins to Holdings"
3473,"Bitcoin Trades Add to El Salvador's Sovereign Risk, Moody's Says"
3474,El Salvador bitcoin experiment not saving country's finances - CNBC
3475,"One month on, El Salvador's bitcoin use grows but headaches persist"
3476,El Salvador endures bumpy first week with bitcoin as legal tender
3477,El Salvador becomes a crypto laboratory with bitcoin gamble
3478,Why El Salvador's Bitcoin embrace worked for these merchants
3479,Estonia crypto ownership numbers
3480,Global Cryptocurrency Ownership Data 2021 - TripleA
3481,"Once a Crypto Trailblazer, Estonia Is Cracking Down on Risk"
3482,[PDF] Cryptocurrency regulations by country - Thomson Reuters
3483,[PDF] Estonian FIU's Survey of Service Providers of Virtual Currency
3484,Estonia cryptocurrency exchange license - crypto license in Estonia ...
3485,Cryptocurrency Regulations Around The World - ComplyAdvantage
3486,How will new Estonian draft legislation affect virtual assets and crypto?
3487,As many as 1 in 10 European households could own crypto
3488,Three key cryptocurrency trends family offices should be aware of
3489,Ethiopia crypto ownership numbers
3490,Ethiopia Ranked 7th in Top 10 Cryptocurrency Holders List of Africa ...
3491,Global Cryptocurrency Ownership Data 2021 - TripleA
3492,Ethiopians Creeping Into Crypto
3493,Ethiopia's blockchain deal is a watershed moment - Down To Earth
3494,[PDF] The 2020 Geography of Cryptocurrency Report - Gov.bc.ca
3495,[PDF] Blockchain and Cryptocurrency in Africa - Baker McKenzie
3496,INSIGHT-How bitcoin met the real world in Africa | Reuters
3497,[PDF] Cryptocurrency Regulations: Institutions and Financial Openness
3498,Renewed Hope: How Bitcoin And Green Energy Can Save ... - Forbes
3499,Fiji crypto ownership numbers
3500,Global Cryptocurrency Ownership Data 2021 - TripleA
3501,[PDF] The 2020 Geography of Cryptocurrency Report - Gov.bc.ca
3502,[PDF] PRESS RELEASE - Fiji Financial Intelligence Unit
3503,Bitcoin paradise? Briton creates 'crypto utopia' in South Pacific
3504,Crypto millionaires building their own cities in Central America
3505,Top ten companies with most bitcoin hold over 204000 in total
3506,Why criminals can't hide behind Bitcoin | Science | AAAS
3507,Cryptocurrencies and blockchain - World Bank Documents
3508,The Business Benefit of Using Cryptocurrency | Deloitte US
3509,Finland crypto ownership numbers
3510,Global Cryptocurrency Ownership Data 2021 - TripleA
3511,Cryptocurrency adoption by country 2019-2021 - Statista
3512,[PDF] Cryptocurrency regulations by country - Thomson Reuters
3513,[PDF] Compendium – Cryptocurrency regulations by country
3514,Cryptocurrency Concerns vs Regulations in Europe - CoinShares
3515,[PDF] Crypto-Assets Activity around the World
3516,75 Cryptocurrency Statistics Show Crypto's Gone Mainstream
3517,[PDF] Crypto: A New Asset Class? - Goldman Sachs
3518,[PDF] An Analysis of the Cryptocurrency Industry - ScholarlyCommons
3519,France crypto ownership numbers
3520,Cryptocurrency Ownership Data for France 2021 - TripleA
3521,Cryptocurrency Regulation in France: Updated Guide (June 2021)
3522,As many as 1 in 10 European households could own crypto
3523,Cryptos on the rise 2022 | Thomson Reuters
3524,Towards a new regime for crypto-assets in France | AMF
3525,Crypto adoption in Europe lags behind most of the world - Euronews
3526,30% of the French plan to invest in cryptocurrencies | Ipsos
3527,For a few cryptos more: the Wild West of crypto finance
3528,French Polynesia crypto ownership numbers
3529,Global Cryptocurrency Ownership Data 2021 - TripleA
3530,Cryptocurrency Ownership Data for France 2021 - TripleA
3531,Top ten companies with most bitcoin hold over 204000 in total
3532,Does your French intellectual property right extend to ... - AJ Park
3533,Why criminals can't hide behind Bitcoin | Science | AAAS
3534,How Jack Dorsey Quit Twitter to Become Bitcoin's Spiritual Leader
3535,Spatial analysis of global Bitcoin mining | Scientific Reports - Nature
3536,PICS: 3-Day Summit to Make Polynesia the Beating Heart of the ...
3537,Cryptocurrency - Nasdaq
3538,Gabon crypto ownership numbers
3539,Global Cryptocurrency Ownership Data 2021 - TripleA
3540,[PDF] Blockchain and Cryptocurrency in Africa - Baker McKenzie
3541,INSIGHT-How bitcoin met the real world in Africa | Reuters
3542,Cryptocurrencies and blockchain - World Bank Documents
3543,Why criminals can't hide behind Bitcoin | Science | AAAS
3544,Top ten companies with most bitcoin hold over 204000 in total
3545,World's Biggest Ever Carbon Credits Issue Planned in Gabon
3546,"Regulation of cryptocurrency around the world Albania, Algeria ..."
3547,[PDF] BLOCKCHAIN IN AFRICA: - GIZ
3548,Georgia crypto ownership numbers
3549,Georgia Ranks 29th Globally by Cryptocurrency Owners - BM.GE
3550,"Former Soviet Republic Is Primed For Crypto Mining, Despite Its ..."
3551,How Many People Own Bitcoin? 95 Blockchain Statistics (2022)
3552,How The Tiny Nation Of Georgia Became A Bitcoin Behemoth - NPR
3553,Have Georgia's crypto glory days passed? - Eurasianet
3554,[PDF] Digital Transformation: Blockchain and Land Titles - OECD
3555,Cryptocurrency in Georgia & Tbilisi | 0% Tax | Easy Exchange
3556,The Bitcoin Whales: 1000 People Who Own 40 Percent of the Market
3557,Germany crypto ownership numbers
3558,Almost half of Germans to invest in crypto: Report - Cointelegraph
3559,What was most popular cryptocurrency in Germany in 2021?
3560,"Cryptocurrency ownership in Germany in 2020, by age - Statista"
3561,"Cryptocurrency ownership in Germany in 2020, by gender - Statista"
3562,Cryptos on the rise 2022 | Thomson Reuters
3563,Travel Rule Crypto in Germany by BaFin [2021] - Notabene
3564,Crypto week at a glance: Bitcoin slips below $30000; Germany ...
3565,Finder Cryptocurrency Adoption Index - Singapore
3566,Ghana crypto ownership numbers
3567,Ghana has the 9th highest rate for cryptocurrency ownership out of ...
3568,Bank of Ghana on digital currency; Crypto ownership for 2021
3569,Financial product or service ownership in Ghana 2021 - Statista
3570,2021 Global Crypto Adoption Index Up 880% - Chainalysis Blog
3571,Ghana Ranks High As A Crypto Ownership Location - NewsDio.com
3572,Blockchain for sustainable development: The case of Ghana
3573,[PDF] Digital Transformation: Blockchain and Land Titles - OECD
3574,Ghana - GovChain
3575,Greece crypto ownership numbers
3576,Global Cryptocurrency Ownership Data 2021 - TripleA
3577,What countries use cryptocurrency the most? | World Economic Forum
3578,[PDF] Cryptocurrency regulations by country - Thomson Reuters
3579,Cryptos on the rise 2022 | Thomson Reuters
3580,Best Crypto Exchanges in Greece for July 2022
3581,[PDF] Crypto-Assets Activity around the World
3582,Chart: How Common is Crypto? - Statista
3583,[PDF] Regulation of Cryptocurrency Around the World: November 2021 ...
3584,[PDF] EU Blockchain Ecosystem developments
3585,Guatemala crypto ownership numbers
3586,Global Cryptocurrency Ownership Data 2021 - TripleA
3587,Crypto millionaires building their own cities in Central America
3588,Chinese investors flock to the 'wild west in crypto' - Financial Times
3589,"Central banks of Honduras, Guatemala eye digital currencies as El ..."
3590,Facebook scales back its crypto ambitions once again - TechCrunch
3591,Why criminals can't hide behind Bitcoin | Science | AAAS
3592,Corporates investing in crypto | Deloitte US
3593,Bitcoin Believers Look for New Paradise at Mayan Lake - El Faro
3594,Cryptocurrencies and blockchain - World Bank Documents
3595,Guyana crypto ownership numbers
3596,Global Cryptocurrency Ownership Data 2021 - TripleA
3597,Future Of Bitcoin Trading In Guyana - The Freeman Online
3598,[PDF] Cryptocurrency Regulations: Institutions and Financial Openness
3599,Why criminals can't hide behind Bitcoin | Science | AAAS
3600,Digital 2021 Guyana (January 2021) v01 - SlideShare
3601,The Business Benefit of Using Cryptocurrency | Deloitte US
3602,Guyana: gross national income per capita 2011-2020 - Statista
3603,Accounting for cryptocurrencies - ACCA Global
3604,EY Guyana - Home | Building a better working world
3605,Haití crypto ownership numbers
3606,Global Cryptocurrency Ownership Data 2021 - TripleA
3607,Cryptocurrency Ownership Data for Egypt 2021 - TripleA
3608,[PDF] Cryptocurrency Regulations: Institutions and Financial Openness
3609,Why criminals can't hide behind Bitcoin | Science | AAAS
3610,INSIGHT-How bitcoin met the real world in Africa | Reuters
3611,Wall Street Asks If Bitcoin Can Ever Replace Fiat Currencies
3612,Paying With Bitcoin in World Crypto Capital El Salvador is Infuriating
3613,Top ten companies with most bitcoin hold over 204000 in total
3614,Cryptocurrencies and blockchain - World Bank Documents
3615,Honduras crypto ownership numbers
3616,Global Cryptocurrency Ownership Data 2021 - TripleA
3617,Crypto millionaires building their own cities in Central America
3618,'Bitcoin Valley' Launches in Honduras — 60 Businesses Accept BTC ...
3619,Bitcoin fever reaches Honduras with first cryptocurrency ATM
3620,Honduras launches 'Bitcoin Valley' in the tourist town of Santa Lucia
3621,[PDF] Digital Transformation: Blockchain and Land Titles - OECD
3622,New 'Bitcoin Hub' Opens in Honduras - The BTC Times
3623,Honduras Welcomes Tourists To Bitcoin Valley In Santa Lucia
3624,Bitcoin Valley' Launches in Honduras — 60 Businesses Accept BTC ...
3625,Hong Kong crypto ownership numbers
3626,Hongkongers are among the world's biggest investors in ...
3627,Finder Cryptocurrency Adoption Index - | Finder Hong Kong
3628,[PDF] Discussion Paper on Crypto-assets and Stablecoins
3629,Visa Study: Consumers in Hong Kong see crypto as the financial ...
3630,New crypto owners nearly doubled in 3 key regions in 2021: Report
3631,Cryptos on the rise 2022 | Thomson Reuters
3632,Why Hong Kong's crypto crown is slipping - Financial Times
3633,"Crypto Scams in Hong Kong and Points to Note | Oldham, Li & Nie"
3634,Global crypto awareness: Singapore beats Canada and Hong Kong
3635,Hungary crypto ownership numbers
3636,Cryptocurrency usage in Hungary 2021 - Statista
3637,[PDF] Cryptocurrency regulations by country - Thomson Reuters
3638,Cryptos on the rise 2022 | Thomson Reuters
3639,Cryptocurrency Regulations in Hungary - Gurcan Partners Law Firm
3640,Hungary Plans to Cut Taxes On Bitcoin In Half - Nasdaq
3641,Five arrests in Hungary for money laundering across three continents
3642,Hungary Bends to EU Demands as Forint Woes Add Urgency for ...
3643,[PDF] The Opinion of the Hungarian National Authority for Data Protection ...
3644,Iceland crypto ownership numbers
3645,Global Cryptocurrency Ownership Data 2021 - TripleA
3646,Largest Bitcoin Mining Farms in the World | Sunbird DCIM
3647,Iceland's Big Bitcoin Heist | Vanity Fair
3648,Bitcoin mining: Is Scandinavia's cryptoboom coming to an end? - DW
3649,Russia Values Local Crypto at $200 Billion as Rules Near
3650,"Bitcoin mini-mining rig costs $875, lets owner mine from Starbucks"
3651,Cryptocurrencies - On the cusp of mainstream? - Mercer
3652,Top ten companies with most bitcoin hold over 204000 in total
3653,Bitcoin Mining Uses More Energy Than Homes Do in Iceland - Fortune
3654,India crypto ownership numbers
3655,Cryptocurrency Ownership Data for India 2021 - TripleA
3656,India has highest number of crypto owners in the world at 10.07 crore
3657,Cryptocurrency adoption index and patterns in India: Finder's report ...
3658,"India has more than 10 crore crypto owners now, highest in the world"
3659,India Tops The List Of Crypto Ownership With 100 Million Hodlers ...
3660,Finder Cryptocurrency Adoption Index - finder India
3661,"India has world's largest number of crypto owners, most under 35"
3662,India Has Highest Number of Cryptocurrency Owners in the World at ...
3663,Why estimates of India's crypto-owning population could be ...
3664,Indonesia crypto ownership numbers
3665,Indonesia Enjoys The Highest Crypto Adoption Rate Worldwide: Study
3666,Indonesia's crypto industry in 2021: A kaleidoscope - Cointelegraph
3667,Over 6.5 million Indonesians bought or sold crypto in first 5 ... - KrASIA
3668,A Simple Guide to Trading Cryptocurrency in Indonesia
3669,Finder Cryptocurrency Adoption Index - finder Indonesia
3670,Indonesia's Growing Crypto Industry
3671,11% of Indonesians own cryptocurrency - Asia Times
3672,Indonesian Crypto Industry in 2021: A Kaleidoscope - LinkedIn
3673,Indonesia and Brazil lead the world among cryptocurrency investors
3674,Iran crypto ownership numbers
3675,"Up to 12 Million Iranians Own Cryptocurrency, Traders Choose ..."
3676,Global Cryptocurrency Ownership Data 2021 - TripleA
3677,How Iran Uses Bitcoin Mining to Evade Sanctions - Elliptic
3678,Cryptos on the rise 2022 | Thomson Reuters
3679,[PDF] The 2020 Geography of Cryptocurrency Report - Gov.bc.ca
3680,Inside Iran's Onslaught on Bitcoin Mining - CoinDesk
3681,Iran: Majlis Enters the Crypto Fray - Financial Tribune
3682,Bitcoin ban: These are the countries where crypto is restricted or illegal
3683,Top ten companies with most bitcoin hold over 204000 in total
3684,New Figures Show Huge Surge In Iran's Cryptocurrency Mining
3685,Iraq crypto ownership numbers
3686,Global Cryptocurrency Ownership Data 2021 - TripleA
3687,[PDF] Regulation of Cryptocurrency Around the World: November 2021 ...
3688,10 Cities That Are Bitcoin Hotspots - Investopedia
3689,Bitcoin ban: These are the countries where crypto is restricted or illegal
3690,The Inevitability of Crypto in Iraq | Abdurrahman Bapir - CoinDesk
3691,Crypto is fully banned in China and 8 other countries - Fortune
3692,"Global Crypto Users Can Reach 1 Billion by December 2022, says ..."
3693,Iraq's financial inclusion drive boosted by homegrown fintech
3694,75 Cryptocurrency Statistics Show Crypto's Gone Mainstream
3695,Ireland crypto ownership numbers
3696,Global Cryptocurrency Ownership Data 2021 - TripleA
3697,Ireland Named 6th Most 'Crypto-ready' Country in the World
3698,Cryptocurrencies and crypto-assets - Revenue
3699,Most cryptocurrency owners are in their 20s and 30s - Independent.ie
3700,Cryptos on the rise 2022 | Thomson Reuters
3701,[PDF] Cryptocurrency regulations by country - Thomson Reuters
3702,Crypto countries: Tracking global interest in cryptocurrencies
3703,Crypto adoption in Europe lags behind most of the world - Euronews
3704,Israel crypto ownership numbers
3705,Report: One third of Israelis and Emiratis own cryptocurrency
3706,[PDF] Blockchain for SMEs and entrepreneurs in Israel - OECD
3707,Survey Shows Crypto Usage in the Middle East on the Rise
3708,Welcome to the Crypto Age | Israel Innovation
3709,New crypto owners nearly doubled in 3 key regions in 2021: Report
3710,[PDF] Cryptocurrency regulations by country - Thomson Reuters
3711,Cryptos on the rise 2022 | Thomson Reuters
3712,10 Cities That Are Bitcoin Hotspots - Investopedia
3713,Italy crypto ownership numbers
3714,Ownership of cryptocurrency in Italy 2018 - Statista
3715,Bitcoin investments among users of Italy's GimmeLike 2021 - Statista
3716,Italy Crypto Adoption Statistics— Data Shows Surging Interest
3717,[PDF] Blockchain for SMEs and entrepreneurs in Italy - OECD
3718,Blockchain & Cryptocurrency Laws and Regulations | Italy | GLI
3719,Cryptocurrency Concerns vs Regulations in Europe - CoinShares
3720,[PDF] Cryptocurrency adoption rates - Finder - 3 Bit Lab
3721,[PDF] Cryptocurrency regulations by country - Thomson Reuters
3722,Ivory Coast crypto ownership numbers
3723,Global Cryptocurrency Ownership Data 2021 - TripleA
3724,INSIGHT-How bitcoin met the real world in Africa | Reuters
3725,Crypto's Greatest Challenge: Legitimacy or Acceptance?
3726,Cryptocurrency: The 'Afro' struggles to become the bitcoin of Africa
3727,"Ivory Coast, Ghana to raise cocoa origin differentials in August"
3728,How Many People Own Bitcoin? 95 Blockchain Statistics (2022)
3729,Bitcoin ownership is on the rise in Canada | Ipsos
3730,Figure of the week: The rapidly increasing role of cryptocurrencies in ...
3731,Ivory Coast Gets Profile Boost as Eni Discovers More Oil and Gas
3732,Jamaica crypto ownership numbers
3733,Global Cryptocurrency Ownership Data 2021 - TripleA
3734,Jamaica Offers Free Money to Digital Currency's First Adopters
3735,"'No Cash, No Problem': Jamaica Picks Tagline for New E-Currency"
3736,Today in Crypto: Jamaica Incentivizes New Users | PYMNTS.com
3737,Top ten companies with most bitcoin hold over 204000 in total
3738,Why criminals can't hide behind Bitcoin | Science | AAAS
3739,Cryptocurrencies and Digital money - DW Observatory
3740,Cryptocurrencies and blockchain - World Bank Documents
3741,"Cryptocurrency attracting Black, Latino investors and fans - ABC News"
3742,Japan crypto ownership numbers
3743,Number of crypto asset accounts in Japan 2018-2021 - Statista
3744,Global Cryptocurrency Ownership Data 2021 - TripleA
3745,Japan's cryptocurrency market: Set to bloom or wither?
3746,Japan a global leader in cryptocurrency investment
3747,What countries use cryptocurrency the most? | World Economic Forum
3748,How Many People Own Bitcoin? 95 Blockchain Statistics (2022)
3749,Blockchain & Cryptocurrency Laws and Regulations | Japan | GLI
3750,[PDF] Cryptocurrency regulations by country - Thomson Reuters
3751,Jordan crypto ownership numbers
3752,"63+ Cryptocurrency Statistics, Facts & Trends - Buy Bitcoin Worldwide"
3753,Global Cryptocurrency Ownership Data 2021 - TripleA
3754,15 Essential Cryptocurrency Stats for 2022 - Influencer Marketing Hub
3755,Russia Values Local Crypto at $200 Billion as Rules Near
3756,10 Cities That Are Bitcoin Hotspots - Investopedia
3757,INSIGHT-How bitcoin met the real world in Africa | Reuters
3758,How Many People Own Bitcoin? 95 Blockchain Statistics (2022)
3759,Legality of cryptocurrency by country or territory - Wikipedia
3760,Inside the Jordan refugee camp that runs on blockchain
3761,Kazakhstan crypto ownership numbers
3762,Global Cryptocurrency Ownership Data 2021 - TripleA
3763,"Even in Kazakhstan, Bitcoin Can't Escape Geopolitics - JSTOR Daily"
3764,Kazakhstan and Cryptocurrency - Freeman Law
3765,Kazakh Ministers Suggest Tenfold Increase In Cryptocurrency Tax
3766,Crypto miners in Kazakhstan face bitter winter of power cuts
