,0
0,Afghanistan crypto ownership numbers
1,This map shows where cryptocurrency is taking off around the world
2,"Bitcoin in Afghanistan: Cryptocurrency, the Taliban, and capital flight"
3,2021 Global Crypto Adoption Index Up 880% - Chainalysis Blog
4,Crypto remittances are a lifeline for the world's most vulnerable
5,INSIGHT-How bitcoin met the real world in Africa | Reuters
6,Is Crypto Really Worth $3 Trillion? - Bloomberg.com
7,World's Biggest Crypto Fortune Began With a Friendly Poker Game
8,Money Reimagined: Afghan Activist Roya Mahboob on Crypto
9,Bitcoin's transformative potential | Accenture UK
10,Albania crypto ownership numbers
11,Global Cryptocurrency Ownership Data 2021 - TripleA
12,"Regulation of cryptocurrency around the world Albania, Algeria ..."
13,[PDF] Regulation of Cryptocurrency Around the World: November 2021 ...
14,[PDF] and Statement by the Executive Director for Albania; IMF Coun
15,[PDF] Cryptocurrencies-and-blockchain.pdf - World Bank Documents
16,The Global Findex Database 2021 - World Bank Group
17,Legality of cryptocurrency by country or territory - Wikipedia
18,[PDF] Cryptocurrency Regulations: Institutions and Financial Openness
19,Why criminals can't hide behind Bitcoin | Science | AAAS
20,Algeria crypto ownership numbers
21,Global Cryptocurrency Ownership Data 2021 - TripleA
22,Algeria and Cryptocurrency - Freeman Law
23,[PDF] 1.The Reality of Bitcoin in Algeria and its Future Prospects - ASJP
24,[PDF] Cryptocurrency regulations by country - Thomson Reuters
25,[PDF] The 2020 Geography of Cryptocurrency Report - Gov.bc.ca
26,[PDF] Blockchain and Cryptocurrency in Africa - Baker McKenzie
27,"Regulation of cryptocurrency around the world Albania, Algeria ..."
28,[PDF] Regulation of Cryptocurrency Around the World: November 2021 ...
29,Bitcoin ban: These are the countries where crypto is restricted or illegal
30,Angola crypto ownership numbers
31,Global Cryptocurrency Ownership Data 2021 - TripleA
32,"Regulation of cryptocurrency around the world Albania, Algeria ..."
33,INSIGHT-How bitcoin met the real world in Africa | Reuters
34,Cryptocurrency: The 'Afro' struggles to become the bitcoin of Africa
35,[PDF] BLOCKCHAIN IN AFRICA: - GIZ
36,Angola Says Stolen Assets Worth More Than $24 Billion Estimate
37,Angola and Cryptocurrency - Freeman Law
38,Legality of cryptocurrency by country or territory - Wikipedia
39,The Global Findex Database 2021 - World Bank Group
40,Argentina crypto ownership numbers
41,Cryptocurrency Ownership Data for Argentina 2021 - TripleA
42,Crypto adoption spreads in Argentina even as central bank tightens ...
43,Cryptocurrency adoption by country 2019-2021 - Statista
44,[PDF] The Crypto Report: Our Analysts on the State of Cryptocurrency
45,2021 Global Crypto Adoption Index Up 880% - Chainalysis Blog
46,Argentines Flock to Crypto Games as Economy Eats Up Salaries
47,What countries use cryptocurrency the most? | World Economic Forum
48,Where do the most people own cryptocurrency? - Insider Intelligence
49,Armenia crypto ownership numbers
50,Georgia Ranks 29th Globally by Cryptocurrency Owners - BM.GE
51,Russians own 12% of the world's crypto assets - Times of India
52,Top ten companies with most bitcoin hold over 204000 in total
53,Cryptocurrencies and blockchain - World Bank Documents
54,Why criminals can't hide behind Bitcoin | Science | AAAS
55,$50 Million Bitcoin Mining Farm Opens in Armenia
56,Free Economic Zones in Armenia: boundless opportunities in a ...
57,The Business Benefit of Using Cryptocurrency | Deloitte US
58,Australia crypto ownership numbers
59,Crypto Ownership Data for Australia 2021 - TripleA
60,Cryptocurrency in Australia - statistics & facts - Statista
61,Over 1 million Australians now own Cryptocurrencies such as ...
62,Cryptocurrency in Australia: 7 Key Charts & Statistics - Cointree
63,Crypto ownership surges in Australia - Yahoo Finance
64,Australia Has Third-Highest Rate of Crypto Adoption in the World
65,Cryptocurrency Adoption Statistics in Australia - Bankless Times
66,Finder Cryptocurrency Adoption Index | finder.com.au
67,40% of Australians Intend to Buy Cryptocurrency in 2021 - Savvy
68,Austria crypto ownership numbers
69,[PDF] Ownership and purchase intention of crypto-assets - survey results
70,Which factors drive consumers to adopt crypto-assets? Results from ...
71,Ownership and purchase intention of crypto-assets – survey results
72,Cryptos on the rise 2022 | Thomson Reuters
73,[PDF] Cryptocurrency regulations by country - Thomson Reuters
74,Blockchain & Cryptocurrency Laws and Regulations | Austria | GLI
75,Cryptocurrency Concerns vs Regulations in Europe - CoinShares
76,Tax treatment of cryptocurrencies
77,Azerbaijan crypto ownership numbers
78,Global Cryptocurrency Ownership Data 2021 - TripleA
79,[PDF] Azerbaijan: Country Digital Development Overview
80,"Regulation of cryptocurrency around the world Albania, Algeria ..."
81,[PDF] Regulation of Cryptocurrency Around the World: November 2021 ...
82,[PDF] Virtual Currency Regulation Review - Dentons
83,Digital 2021 Azerbaijan (January 2021) v01 - SlideShare
84,[PDF] South Caucasus GovTech for Azerbaijan - World Bank Document
85,Why criminals can't hide behind Bitcoin | Science | AAAS
86,[PDF] Doing Business in Azerbaijan - 2018 - Baker McKenzie
87,Bahamas crypto ownership numbers
88,Global Cryptocurrency Ownership Data 2021 - TripleA
89,Analysis: Central bankers comb for crypto clues as Bahamas ...
90,Bahamas Tops China in Ranking of Central Bank Digital Currencies
91,Crypto Investors are Trying to Buy a Private Island and Tokenize It's ...
92,Crypto bros on the beach feel a cold wind at their necks
93,Blockchain Bites: Crypto Bahamas: Insights from the week
94,[PDF] Cryptocurrency regulations by country - Thomson Reuters
95,Cryptos on the rise 2022 | Thomson Reuters
96,Crypto Curious - Securities Commission of The Bahamas
97,Bahrain crypto ownership numbers
98,Global Cryptocurrency Ownership Data 2021 - TripleA
99,[PDF] GCC: Promoting Blockchain Technology Adoption in the Financial ...
100,[PDF] The 2020 Geography of Cryptocurrency Report - Gov.bc.ca
101,A Tiny Gulf Nation Is Opening Its Doors to Crypto - Bloomberg.com
102,"News Of Bahrain, profile picture"
103,The Best Global Crypto Exchanges - Forbes
104,Bahrain central bank publishes draft rules on digital assets | Reuters
105,Bahrain's Rain Management Aims To Increase Crypto Assets ...
106,"Regulation of cryptocurrency around the world Albania, Algeria ..."
107,Bangladesh crypto ownership numbers
108,Global Cryptocurrency Ownership Data 2021 - TripleA
109,[PDF] National Blockchain Strategy: Bangladesh
110,Cryptos on the rise 2022 | Thomson Reuters
111,[PDF] Cryptocurrency regulations by country - Thomson Reuters
112,A Blockchain-based Land Title Management System for Bangladesh
113,Cryptocurrency Statistics 2022: Investing In Crypto - Bankrate.com
114,Cryptocurrency trading neither legal nor crime: BB
115,For a few cryptos more: the Wild West of crypto finance
116,(PDF) A Systematic Literature Review of Blockchain Technology ...
117,Barbados crypto ownership numbers
118,Global Cryptocurrency Ownership Data 2021 - TripleA
119,"The Barbados Jurisdiction, Crypto Assets, And The International ..."
120,FINTECH: New crypto owners nearly doubled in 3 key r... - IFC Review
121,"Cryptocurrencies, Blockchain Technology and the Real Property ..."
122,Barbados to Launch the World's First Metaverse Embassy
123,Bitt Reveals Big Plans for Cross-Caribbean Blockchain Settlement ...
124,[PDF] Crypto Focus Newsletter: 1Q 2022 - assets.kpmg
125,[PDF] Cryptocurrency Regulations: Institutions and Financial Openness
126,Billionaires 2022: These 4 Countries Got Their First ... - Forbes
127,Belarus crypto ownership numbers
128,Global Cryptocurrency Ownership Data 2021 - TripleA
129,"The Belarusian regime's ""crypto friendliness"" - bne IntelliNews"
130,Belarus is about to become a major crypto hub - COBALT's legal
131,Belarus President Signs Decree Endorsing Free Flow of ...
132,[PDF] The 2020 Geography of Cryptocurrency Report - Gov.bc.ca
133,Blockchain.com wallets 2011-2022 - Statista
134,Belarus - blockchain and automatic exchange of financial ...
135,Bitcoin Volume Spikes in Russia and Ukraine as Sanctions Hit
136,Belgium crypto ownership numbers
137,"Belgium, Luxembourg, Netherlands: cryptocurrency ownership 2018"
138,Preferred sources of information on cryptocurrency in Belgium 2018
139,Cryptocurrency Ownership Data for Netherlands 2021 - TripleA
140,Belgium and Cryptocurrency - Freeman Law
141,Blockchain means we've already passed 'peak fund' - Schroders
142,[PDF] Cryptocurrency regulations by country - Thomson Reuters
143,Cryptos on the rise 2022 | Thomson Reuters
144,For a few cryptos more: the Wild West of crypto finance
145,Belize crypto ownership numbers
146,Global Cryptocurrency Ownership Data 2021 - TripleA
147,FINTECH: New crypto owners nearly doubled in 3 key r... - IFC Review
148,"Crypto owners lost tons of money lately, but the rest of us are ... - NPR"
149,Top ten companies with most bitcoin hold over 204000 in total
150,Belize: Selected Issues Paper
151,Why criminals can't hide behind Bitcoin | Science | AAAS
152,Cryptocurrencies and blockchain - World Bank Documents
153,The Business Benefit of Using Cryptocurrency | Deloitte US
154,Bitcoin Awareness And Adoption In Singapore Is Huge - Nasdaq
155,Benin crypto ownership numbers
156,Global Cryptocurrency Ownership Data 2021 - TripleA
157,Cryptocurrency Ownership Data for Nigeria 2021 - TripleA
158,[PDF] Regulation of Cryptocurrency Around the World: November 2021 ...
159,e-Infrastructure and e-Services for Developing Countries: 13th EAI ...
160,[PDF] BLOCKCHAIN IN AFRICA: - GIZ
161,Why criminals can't hide behind Bitcoin | Science | AAAS
162,"Cryptocurrency ownership in Nigeria, Malaysia highest in the world"
163,The Crypto Market is Not Immune to Contagion Risk - Nasdaq
164,The Role of Market Surveillance: Building Trust in Crypto Markets
165,Bermuda crypto ownership numbers
166,Bermuda blockchain and cryptocurrency regulation 2022
167,"[PDF] Bermuda blockchain and cryptocurrency regulation 2022, fourth ..."
168,Bermuda and Cryptocurrency - Freeman Law
169,[PDF] Cryptocurrency regulations by country - Thomson Reuters
170,Global Cryptocurrency Ownership Data 2021 - TripleA
171,FINTECH: New crypto owners nearly doubled in 3 key r... - IFC Review
172,"[PDF] Bermuda's FinTech Triangle: Blockchain, ICOs and Virtual Currencies"
173,Circle Paves The Way For International Crypto Offerings ... - Forbes
174,Binance - Wikipedia
175,Bolivia crypto ownership numbers
176,Global Cryptocurrency Ownership Data 2021 - TripleA
177,[PDF] Cryptocurrency regulations by country - Thomson Reuters
178,How Many People Own Bitcoin? 95 Blockchain Statistics (2022)
179,Bitcoin ban: These are the countries where crypto is restricted or illegal
180,Cryptocurrency Regulations Around The World - ComplyAdvantage
181,For a few cryptos more: the Wild West of crypto finance
182,Cryptocurrency Statistics 2022: Investing In Crypto - Bankrate.com
183,[PDF] Cryptocurrency Regulations: Institutions and Financial Openness
184,Crypto is fully banned in China and 8 other countries - Fortune
185,Bosnia and Herzegovina crypto ownership numbers
186,Global Cryptocurrency Ownership Data 2021 - TripleA
187,Bosnia and Herzegovina and Cryptocurrency - Freeman Law
188,Top ten companies with most bitcoin hold over 204000 in total
189,Cryptocurrencies and blockchain - World Bank Documents
190,Individuals using the Internet (% of population) - World Bank Data
191,Why criminals can't hide behind Bitcoin | Science | AAAS
192,The Business Benefit of Using Cryptocurrency | Deloitte US
193,Quantum computers and the Bitcoin Blockchain | Deloitte Netherlands
194,9 Exchanges to Buy Crypto in Bosnia and Herzegovina (2022)
195,Botswana crypto ownership numbers
196,Global Cryptocurrency Ownership Data 2021 - TripleA
197,[PDF] Blockchain and Cryptocurrency in Africa - Baker McKenzie
198,INSIGHT-How bitcoin met the real world in Africa | Reuters
199,The rise of crypto adoption in Africa - International Finance Magazine
200,Botswana to Regulate Crypto That Was Feared Becoming 'Wild West'
201,Botswana and Cryptocurrency - Freeman Law
202,The Global Findex Database 2021 - World Bank Group
203,Why criminals can't hide behind Bitcoin | Science | AAAS
204,Cryptocurrency: The 'Afro' struggles to become the bitcoin of Africa
205,Brazil crypto ownership numbers
206,"Why is Brazil, a country of contrasts, where the poorest use crypto ..."
207,Nearly half of crypto owners first bought digital assets in 2021: Study
208,Indonesia and Brazil lead the world among cryptocurrency investors
209,"Indonesia, Brazil lead the world in crypto adoption: survey"
210,Why Brazil Is the Big Latin American Bet for Global Crypto Exchanges
211,Crypto adoption reached a 'tipping point' in 2021 - TRT World
212,Cryptocurrency adoption by country 2019-2021 - Statista
213,Softbank-Backed 2TM Cuts About 90 Jobs as Crypto Winter Lingers
214,Brunei Darussalam crypto ownership numbers
215,Future of Bitcoin Trading in Brunei Darussalam - Native News Online
216,Brunei and Cryptocurrency - Freeman Law
217,[PDF] Regulation of Cryptocurrency Around the World: November 2021 ...
218,"""MAS' Approach to the Crypto Ecosystem"" - Summary of Keynote ..."
219,Why criminals can't hide behind Bitcoin | Science | AAAS
220,Legality of cryptocurrency by country or territory - Wikipedia
221,Cryptocurrency Ownership Data for Vietnam 2021 - TripleA
222,The Business Benefit of Using Cryptocurrency | Deloitte US
223,[PDF] ASEAN Investment Report 2020–2021
224,Bulgaria crypto ownership numbers
225,Bulgaria – the 2nd largest Bitcoin owner in the world - Nomoretax
226,Bulgaria ahead of El Salvador in bitcoin holdings? - TrendingTopics
227,"Govts, companies own 8% of all Bitcoins worth $46 bn in the world"
228,Who is Who in the Bulgarian crypto ecosystem - The Recursive
229,Bulgaria and Cryptocurrency - Freeman Law
230,Who Owns the Most Bitcoin Now? (2022) - Bybit Learn
231,Who Owns the Most Bitcoin? | River Financial
232,Which Governments Are Hoarding Bitcoin? - Investopedia
233,[PDF] Cryptocurrency regulations by country - Thomson Reuters
234,Burkina Faso crypto ownership numbers
235,Global Cryptocurrency Ownership Data 2021 - TripleA
236,INSIGHT-How bitcoin met the real world in Africa | Reuters
237,"Regulation of cryptocurrency around the world Albania, Algeria ..."
238,[PDF] THE AFRICAN BLOCKCHAIN REPORT 2021 - Standard Bank
239,Cameroon's Ejara raises $2M to offer crypto and investment services ...
240,Cryptocurrency: The 'Afro' struggles to become the bitcoin of Africa
241,Why criminals can't hide behind Bitcoin | Science | AAAS
242,Cryptocurrencies and blockchain - World Bank Documents
243,[PDF] BLOCKCHAIN IN AFRICA: - GIZ
244,Cabo Verde crypto ownership numbers
245,Global Cryptocurrency Ownership Data 2021 - TripleA
246,[PDF] Regulation of Cryptocurrency Around the World: November 2021 ...
247,"Regulation of cryptocurrency around the world Albania, Algeria ..."
248,[PDF] The 2020 Geography of Cryptocurrency Report - Gov.bc.ca
249,The ongoing evolution of global crypto markets | Refinitiv Perspectives
250,[PDF] Stakeholder-Engagement-Plan-SEP-Digital-Cabo-Verde-P171099.pdf
251,The Global Findex Database 2021 - World Bank Group
252,Why criminals can't hide behind Bitcoin | Science | AAAS
253,[PDF] BLOCKCHAIN IN AFRICA: - GIZ
254,Cambodia crypto ownership numbers
255,Cambodia's digital currency reaches nearly half the population
256,Global Cryptocurrency Ownership Data 2021 - TripleA
257,Will Cambodia legalise and embrace Crypto after SERC & Binance ...
258,[PDF] Central Bank Digital Currency Solution in Cambodia
259,"[PDF] G2P and International Digital Remittances During COVID-19, Early ..."
260,Cambodia's digital currency can show other central banks the way
261,[PDF] APG-Follow-Up-Report-Cambodia-2021.pdf - FATF
262,44 Amazing Cryptocurrency Statistics You Need to Know - Techjury
263,[PDF] PwC CBDC global index
264,Cameroon crypto ownership numbers
265,Global Cryptocurrency Ownership Data 2021 - TripleA
266,Cameroon's Ejara raises $2M to offer crypto and investment services ...
267,Crypto-currency adoption in Africa: The ups and downs
268,INSIGHT-How bitcoin met the real world in Africa | Reuters
269,Cryptocurrency: The 'Afro' struggles to become the bitcoin of Africa
270,"Regulation of cryptocurrency around the world Albania, Algeria ..."
271,[PDF] BLOCKCHAIN IN AFRICA: - GIZ
272,South Africa dethrones Kenya in cryptocurrency ownership
273,CAMEROON: An Introduction to General Business Law - Chambers
274,Canada crypto ownership numbers
275,Cryptocurrency Ownership Data for Canada 2021 | TripleA
276,Bitcoin ownership is on the rise in Canada | Ipsos
277,"Cryptocurrency ownership in Canada 2016-2018, by gender - Statista"
278,"Cryptocurrency ownership in Canada 2016-2018, by age - Statista"
279,Finder Cryptocurrency Adoption Index - finder CA
280,"[PDF] Bitcoin Awareness, Ownership and Use: 2016–20 | Bank of Canada"
281,[PDF] Bitcoin Adoption and Beliefs in Canada
282,Cryptocurrency is on the rise among Canadian consumers
283,"13% of Surveyed Canadians Owned Bitcoin in 2021, Up from 5% in ..."
284,Cayman Islands crypto ownership numbers
285,Blockchain & Cryptocurrency Laws and Regulations | Cayman Islands
286,[PDF] Cryptocurrency regulations by country - Thomson Reuters
287,[PDF] cryptocurrencies andthe offshore financial centres - Kalo Advisors
288,Blockchain technology and cryptocurrency | Cayman Islands
289,Regulation of crypto exchanges and other crypto services in the ...
290,Cryptocurrency in the Cayman Islands
291,The Virtual Currency Regulation Review: Cayman Islands
292,Global Cryptocurrency Ownership Data 2021 - TripleA
293,tm2127871-8_s4 - none - 184.5791484s - SEC.gov
294,Chile crypto ownership numbers
295,Global Cryptocurrency Ownership Data 2021 - TripleA
296,What countries use cryptocurrency the most? | World Economic Forum
297,[PDF] Cryptocurrency regulations by country - Thomson Reuters
298,Cryptocurrency Regulations Around The World - ComplyAdvantage
299,[PDF] The 2020 Geography of Cryptocurrency Report - Gov.bc.ca
300,"In Latin America, Crypto Owners Can Buy Real Estate Using Bitcoin ..."
301,For a few cryptos more: the Wild West of crypto finance
302,[PDF] Chapter 2: The Crypto Ecosystem and Financial Stability Challenges
303,China crypto ownership numbers
304,Number of registered blockchain companies in China 2014-2020
305,Crypto Ownership Data for Hong Kong 2021 - TripleA
306,China Crypto Investors Are Buying More as Beijing Circles
307,Chinese investors flock to the 'wild west in crypto' - Financial Times
308,Chinese cryptocurrency traders look for ways around ban
309,2021 Global Crypto Adoption Index Up 880% - Chainalysis Blog
310,China declares all crypto-currency transactions illegal - BBC News
311,This map shows where cryptocurrency is taking off around the world
312,Colombia crypto ownership numbers
313,Colombia: cryptocurrency interest of millennials - Statista
314,Cryptocurrency adoption by country 2019-2021 - Statista
315,What countries use cryptocurrency the most? | World Economic Forum
316,How Many People Own Bitcoin? 95 Blockchain Statistics (2022)
317,This map shows where cryptocurrency is taking off around the world
318,"2022, the year of the crypto economy in Latin America - RSM Global"
319,[PDF] Cryptocurrency regulations by country - Thomson Reuters
320,Finder's Poll Shows Vietnam Holds the Highest Percentage of ...
321,Costa Rica crypto ownership numbers
322,Global Cryptocurrency Ownership Data 2021 - TripleA
323,Crypto millionaires building their own cities in Central America
324,Cryptocurrency in Costa Rica | Remax Ocean Surf & Sun
325,[PDF] Regulation of Cryptocurrency Around the World: November 2021 ...
326,Costa Rica and Cryptocurrency - Freeman Law
327,World's Biggest Bitcoin Experiment Is a Surf Town in El Salvador
328,Paying With Bitcoin in World Crypto Capital El Salvador is Infuriating
329,[PDF] Cryptocurrency Regulations: Institutions and Financial Openness
330,The Complete Guide to Cryptocurrency Statistics for August 2022
331,Croatia crypto ownership numbers
332,Global Cryptocurrency Ownership Data 2021 - TripleA
333,Guide to cryptocurrency in Croatia
334,Cryptocurrency License in Croatia | Law&Trust International
335,How to buy bitcoin in Croatia - Itez.com instruction
336,Tax Treatment of Crypto Currency in Croatia - LinkedIn
337,Croatian Post Is Helping Croatians Convert Bitcoin To Kuna - Bitcoinist
338,[PDF] EU Blockchain Ecosystem developments
339,Crypto market in Croatia: Why is Bitcoin not widely talked about after ...
340,[PDF] Regulation of Cryptocurrency Around the World: November 2021 ...
341,Cuba crypto ownership numbers
342,"In Cuba, cryptocurrency gains momentum - NBC News"
343,You Would Understand Bitcoin if You Were Under Cuba's Embargo
344,"Mark Cuban on his crypto portfolio: I own Ethereum, ether, and bitcoin"
345,Global Cryptocurrency Ownership Data 2021 - TripleA
346,Cuba and Cryptocurrency - Freeman Law
347,Cuba to Dole Out Crypto Licenses Amid Continued U.S. Sanctions
348,"In Cuba, cryptocurrency gains momentum - Yahoo News"
349,"Cuba approves cryptocurrency services, requires central bank license"
350,100000 Cubans Are Using Cryptocurrencies to Bypass Financial ...
351,Here's What Mark Cuban Said About the Recent Crypto Crash
352,Cyprus crypto ownership numbers
353,Global Cryptocurrency Ownership Data 2021 - TripleA
354,Crypto assets in corporate insolvency in Cyprus - IFLR
355,Blockchain & Cryptocurrency Laws and Regulations | Cyprus | GLI
356,CRYPTO ASSET SERVICES PROVIDERS (CASP)
357,Cyprus introduces first steps towards Crypto-Asset regulation ...
358,The novel registration of Crypto-Assets Service Providers in Cyprus
359,Crypto countries: Tracking global interest in cryptocurrencies
360,How to Buy Property with Cryptocurrency in Cyprus - Lexology
361,10 Cities That Are Bitcoin Hotspots - Investopedia
362,Czech Republic crypto ownership numbers
363,Global Cryptocurrency Ownership Data 2021 - TripleA
364,Annual cryptocurrency trading volume in Czechia 2019-2021 - Statista
365,[PDF] Cryptocurrency regulations by country - Thomson Reuters
366,Cryptos on the rise 2022 | Thomson Reuters
367,Guidance issued on the VAT treatment of cryptocurrency transactions
368,"Czech Republic Crypto License (10,900 EUR)"
369,[PDF] EU Blockchain Ecosystem developments
370,"Crypto Collapse Threatens to Leave Black, Hispanic Investors ..."
371,Best Crypto Exchange in the Czech Republic for August 2022
372,Democratic Republic of Congo crypto ownership numbers
373,Global Cryptocurrency Ownership Data 2021 - TripleA
374,[PDF] Blockchain and Cryptocurrency in Africa - Baker McKenzie
375,INSIGHT-How bitcoin met the real world in Africa | Reuters
376,China Cash Flowed Through Congo Bank to Former President's ...
377,Cryptocurrencies - On the cusp of mainstream? - Mercer
378,The Global Findex Database 2021 - World Bank Group
379,Top ten companies with most bitcoin hold over 204000 in total
380,Why criminals can't hide behind Bitcoin | Science | AAAS
381,The Business Benefit of Using Cryptocurrency | Deloitte US
382,Denmark crypto ownership numbers
383,Global Cryptocurrency Ownership Data 2021 - TripleA
384,Cryptocurrencies (Bitcoins etc.) - Skat.dk
385,What countries use cryptocurrency the most? | World Economic Forum
386,[PDF] Cryptocurrency regulations by country - Thomson Reuters
387,Denmark's Tax Authority Sends Warning Letters to 20000 Crypto ...
388,Crypto adoption in Europe lags behind most of the world - Euronews
389,Singapore is the world's top crypto country in latest world ... - ZDNet
390,[PDF] Central Bank Digital Currency in Denmark? - Danmarks Nationalbank
391,Cryptocurrency Concerns vs Regulations in Europe - CoinShares
392,Dominican Republic crypto ownership numbers
393,Global Cryptocurrency Ownership Data 2021 - TripleA
394,Countries where cryptocurrencies are not prohibited
395,Cryptocurrency Statistics 2022: Investing In Crypto - Bankrate.com
396,Dominican Republic and Cryptocurrency - Freeman Law
397,[PDF] Crypto-Assets Activity around the World
398,[PDF] Cryptocurrency Regulations: Institutions and Financial Openness
399,[PDF] Regulation of Crypto Assets - International Monetary Fund
400,Why criminals can't hide behind Bitcoin | Science | AAAS
401,India's proposed Crypto tax - Avalara
402,Ecuador crypto ownership numbers
403,Global Cryptocurrency Ownership Data 2021 - TripleA
404,How Many People Own Bitcoin? 95 Blockchain Statistics (2022)
405,[PDF] Cryptocurrency regulations by country - Thomson Reuters
406,Cryptos on the rise 2022 | Thomson Reuters
407,Crypto millionaires building their own cities in Central America
408,Ecuador becomes the first country to roll out its own digital cash
409,"63+ Cryptocurrency Statistics, Facts & Trends - Buy Bitcoin Worldwide"
410,World's Biggest Bitcoin Experiment Is a Surf Town in El Salvador
411,Egypt crypto ownership numbers
412,Global Cryptocurrency Ownership Data 2021 - TripleA
413,Morocco tops Arab world in terms of crypto owners followed by Egypt
414,Crypto stats: Adoption in Saudi; Solana and more! - BitOasis Blog
415,Inside Egypt's cryptocurrency market - EgyptToday
416,Saudis come third among Arab cryptocurrency owners
417,Bitcoin (BTC) trading volume in 44 countries worldwide in 2020
418,[PDF] Cryptocurrency regulations by country - Thomson Reuters
419,Cryptos on the rise 2022 | Thomson Reuters
420,El Salvador crypto ownership numbers
421,Bitcoin in El Salvador - statistics & facts - Statista
422,"El Salvador Buys Bitcoin Dip, Adding 500 Coins to Holdings"
423,"Bitcoin Trades Add to El Salvador's Sovereign Risk, Moody's Says"
424,El Salvador bitcoin experiment not saving country's finances - CNBC
425,"One month on, El Salvador's bitcoin use grows but headaches persist"
426,El Salvador endures bumpy first week with bitcoin as legal tender
