,0
853,Corporates investing in crypto | Deloitte US
854,"India, Maldives sign six pacts; widen defence partnership"
855,How Many People Own Bitcoin? 95 Blockchain Statistics (2022)
856,Global Financial Crisis - an overview | ScienceDirect Topics
857,Mali crypto ownership numbers
858,Global Cryptocurrency Ownership Data 2021 - TripleA
859,INSIGHT-How bitcoin met the real world in Africa | Reuters
860,Crypto's Greatest Challenge: Legitimacy or Acceptance?
861,Cryptocurrencies and blockchain - World Bank Documents
862,Bitcoin Awareness And Adoption In Singapore Is Huge - Nasdaq
863,Survey Reveals Shifts In Bitcoin Ownership Demographics
864,[PDF] BLOCKCHAIN IN AFRICA: - GIZ
865,How Many People Own Bitcoin? 95 Blockchain Statistics (2022)
866,Mali | Private Sector | World Bank Development Indicators
867,Malta crypto ownership numbers
868,Global Cryptocurrency Ownership Data 2021 - TripleA
869,Is Malta the domicile of choice for crypto-millionaires?
870,How Malta's System Is Embracing The Crypto Revolution
871,Bitcoin ownership among US crypto owners at 81% in March 2021 ...
872,"[PDF] Crypto-assets - Key developments, regulatory concerns and ..."
873,Cryptocurrency Regulations Around The World - ComplyAdvantage
874,[PDF] GLOBAL CRYPTOASSET REGULATORY LANDSCAPE STUDY
875,10 Cities That Are Bitcoin Hotspots - Investopedia
876,"Coinbase Global, Inc. - SEC.gov"
877,Mauritius crypto ownership numbers
878,Global Cryptocurrency Ownership Data 2021 - TripleA
879,[PDF] taxation of bitcoin transactions in mauritius: a comparative study with ...
880,[PDF] Blockchain and Cryptocurrency in Africa - Baker McKenzie
881,Mauritius Releases Guidance for Regulated Security Token Offerings
882,[PDF] Regulation of Cryptocurrency Around the World: November 2021 ...
883,Cryptocurrency - Developments In Mauritius - Fin Tech - Mondaq
884,Mauritius Home Ownership Rate - 2022 Data - 2023 Forecast
885,Mauritius Trails Peers in Race to Pre-Covid Tourist Numbers
886,Top ten companies with most bitcoin hold over 204000 in total
887,Mexico crypto ownership numbers
888,Global Cryptocurrency Ownership Data 2021 - TripleA
889,Finder Cryptocurrency Adoption Index | finder.com
890,What countries use cryptocurrency the most? | World Economic Forum
891,[PDF] Cryptocurrency regulations by country - Thomson Reuters
892,[PDF] The 2020 Geography of Cryptocurrency Report - Gov.bc.ca
893,[PDF] Cryptocurrency adoption rates - Finder - 3 Bit Lab
894,"India Tops List Of 27 Nations Surveyed For Crypto Ownership, Says ..."
895,Cryptocurrency Regulations Around The World - ComplyAdvantage
896,"Moldova, Republic of crypto ownership numbers"
897,Global Cryptocurrency Ownership Data 2021 - TripleA
898,(PDF) Blockchain and Bitcoin as a Way to Lift a Country out of Poverty
899,[PDF] Regulation of Cryptocurrency Around the World: November 2021 ...
900,Cryptocurrencies - On the cusp of mainstream? - Mercer
901,Top ten companies with most bitcoin hold over 204000 in total
902,Is the acceleration of institutional cryptocurrency adoption ...
903,[PDF] Republic of Moldova 2018 - Flanders Investment and Trade
904,[PDF] Moneyval-Mutual-Evaluation-Report-Moldova-2019.pdf - FATF
905,Cryptocurrencies and blockchain - World Bank Documents
906,Monaco crypto ownership numbers
907,Global Cryptocurrency Ownership Data 2021 - TripleA
908,Crypto Visa card company Monaco just spent millions ... - TechCrunch
909,Crypto.com - Wikipedia
910,Cryptos on the rise 2022 | Thomson Reuters
911,Crypto.com Spent Its Way to the Top. Then the Market Crashed. Now ...
912,Crypto.com - Crunchbase Company Profile & Funding
913,Financial Crime Outlook: 2022 and beyond | Monaco | Global law ...
914,"Monaco Planet, a new generation of SocialFi platform to Launch on ..."
915,"Monaco, the future blockchain testing-ground - CMS Law"
916,Mongolia crypto ownership numbers
917,Mongolia is leading the world in cryptocurrency adoption
918,[PDF] The 2020 Geography of Cryptocurrency Report - Gov.bc.ca
919,China's Inner Mongolia to Ban Bitcoin Mining - Decrypt
920,China's underground bitcoin miners - CNBC
921,Bitcoin mining is still huge in China despite new ban in Inner Mongolia
922,Top ten companies with most bitcoin hold over 204000 in total
923,Opinion: China's bitcoin crackdown is not its final act | IFLR
924,The Political Geography and Environmental Impacts of ...
925,Montenegro crypto ownership numbers
926,Global Cryptocurrency Ownership Data 2021 - TripleA
927,"In Montenegro, 1,6% of the population owns cryptocurrency"
928,"Montenegro, the Most Underrated Crypto Jurisdiction"
929,[PDF] Regulation of Cryptocurrency Around the World: November 2021 ...
930,Top ten companies with most bitcoin hold over 204000 in total
931,Crypto License in Montenegro – Get Help from Our Incorporation ...
932,Vitalik Buterin Becomes a Citizen of Montenegro - DailyCoin
933,Why criminals can't hide behind Bitcoin | Science | AAAS
934,Digital 2022 Montenegro (February 2022) v01 - SlideShare
935,Morocco crypto ownership numbers
936,The status of cryptocurrency in Morocco - ScienceDirect.com
937,Morocco tops Arab world in terms of crypto owners followed by Egypt
938,Morocco is number one for Bitcoin trading in North Africa
939,A Report Reveals The Number Of Bitcoin Owners In Morocco... And ...
940,Morocco Remains An African Crypto 'Trading Hub' Despite State Ban
941,[PDF] Cryptocurrency regulations by country - Thomson Reuters
942,Crypto stats: Adoption in Saudi; Solana and more! - BitOasis Blog
943,Saudis come third among Arab cryptocurrency owners
944,Mozambique crypto ownership numbers
945,Global Cryptocurrency Ownership Data 2021 - TripleA
946,INSIGHT-How bitcoin met the real world in Africa | Reuters
947,Cryptocurrencies and blockchain - World Bank Documents
948,This map shows where cryptocurrency is taking off around the world
949,The Role of Market Surveillance: Building Trust in Crypto Markets
950,How Many People Own Bitcoin? 95 Blockchain Statistics (2022)
951,"Mozambique acquisition: Latest News & Videos, Photos about ..."
952,Company Search Page - SEC.gov
953,EDGAR Full Text Search - SEC.gov
954,Myanmar crypto ownership numbers
955,Global Cryptocurrency Ownership Data 2021 - TripleA
956,Myanmar's NUG looks to cryptocurrencies in bid to raise US$1 ...
957,Myanmar: Casino Cities Run on Blockchain Threaten Nation's ...
958,"Crypto, Soros and the Global Drive to Fund Revolution in Myanmar"
959,Myanmar Planning Digital Currency to Aid Economy - PYMNTS.com
960,[PDF] Blockchain for digital government - Draft A - ASEAN
961,Myanmar holds its first blockchain roundtable
962,The Global Findex Database 2021 - World Bank Group
963,Why criminals can't hide behind Bitcoin | Science | AAAS
964,Namibia crypto ownership numbers
965,Global Cryptocurrency Ownership Data 2021 - TripleA
966,[PDF] Blockchain and Cryptocurrency in Africa - Baker McKenzie
967,Crypto-currency adoption in Africa: The ups and downs
968,For a few cryptos more: the Wild West of crypto finance
969,Namibian Bitcoin Trading Platform BTN Trudges on Despite Partial ...
970,Top ten companies with most bitcoin hold over 204000 in total
971,Why criminals can't hide behind Bitcoin | Science | AAAS
972,What countries use cryptocurrency the most? | World Economic Forum
973,2021 Investment Climate Statements: Namibia - Department of State
974,Nepal crypto ownership numbers
975,Global Cryptocurrency Ownership Data 2021 - TripleA
976,Crypto Currency And Its Effect In Nepal | New Spotlight Magazine
977,Cryptocurrency Statistics 2022: Investing In Crypto - Bankrate.com
978,[PDF] Cryptocurrency Regulations: Institutions and Financial Openness
979,For a few cryptos more: the Wild West of crypto finance
980,[PDF] Regulation of Cryptocurrency Around the World: November 2021 ...
981,[PDF] UNCTAD Policy Brief No. 100
982,Bitcoin ban: These are the countries where crypto is restricted or illegal
983,"Crypto and the Dollar Are Partners, Not Rivals - Bloomberg.com"
984,Netherlands crypto ownership numbers
985,"Netherlands: ownership of cryptocurrencies, by type 2018 - Statista"
986,"Netherlands: ownership of cryptocurrencies, by gender 2018 - Statista"
987,Travel Rule Crypto in Netherlands by DNB [2021] - Notabene
988,Dutch regulators unsure of number of crypto investors in Netherlands
989,Cryptos on the rise 2022 | Thomson Reuters
990,How Many People Own Bitcoin? 95 Blockchain Statistics (2022)
991,Why criminals can't hide behind Bitcoin | Science | AAAS
992,Crypto countries: Tracking global interest in cryptocurrencies
993,New Caledonia crypto ownership numbers
994,New Caledonia Home Ownership Rate - 2022 Data - 2023 Forecast
995,Global Cryptocurrency Ownership Data 2021 - TripleA
996,Cryptocurrencies - On the cusp of mainstream? - Mercer
997,Why criminals can't hide behind Bitcoin | Science | AAAS
998,Crypto in focus as FTX buys BlockFi and Voyager Digital halts ...
999,Bitcoin Awareness And Adoption In Singapore Is Huge - Nasdaq
1000,Top ten companies with most bitcoin hold over 204000 in total
1001,New Caledonia - Mazars Group
1002,Top Nickel Miner Vale Turns Page on 14-Year Caledonian Foray
1003,New Zealand crypto ownership numbers
1004,Global Cryptocurrency Ownership Data 2021 - TripleA
1005,"Cryptocurrency trading in NZ below world average, but signs show ..."
1006,[PDF] Crypto-currencies – An introduction to not-so-funny moneys
1007,[PDF] How many active crypto traders are there across the globe?
1008,Cryptos on the rise 2022 | Thomson Reuters
1009,[PDF] Cryptocurrency regulations by country - Thomson Reuters
1010,"63+ Cryptocurrency Statistics, Facts & Trends - Buy Bitcoin Worldwide"
1011,Crypto countries: Tracking global interest in cryptocurrencies
1012,Nicaragua crypto ownership numbers
1013,Global Cryptocurrency Ownership Data 2021 - TripleA
1014,Man Uses Bitcoin to Buy a Piece of Paradise in Nicaragua - CoinDesk
1015,[PDF] Analysis of the Cryptocurrency Adoption Decision: Literature Review
1016,Legality of cryptocurrency by country or territory - Wikipedia
1017,Why criminals can't hide behind Bitcoin | Science | AAAS
1018,Bitcoin ownership is on the rise in Canada | Ipsos
1019,Top ten companies with most bitcoin hold over 204000 in total
1020,Cryptocurrencies and blockchain - World Bank Documents
1021,Visa Introduces Crypto Advisory Services to Help Partners Navigate ...
1022,Nigeria crypto ownership numbers
1023,Finder Survey: Nigeria's 24.2% Adoption Rating Is the Highest Rate ...
1024,"Nigeria ranks ahead of U.S., others in crypto ownership. Bitcoin ..."
1025,Crypto trading is surging in Nigeria despite a government ban ...
1026,"India Tops List Of 27 Nations Surveyed For Crypto Ownership, Says ..."
1027,Lack of proper financial services boosts crypto ownership in Nigeria ...
1028,Finder Cryptocurrency Adoption Index - finder Nigeria
1029,What countries use cryptocurrency the most? | World Economic Forum
1030,Cryptocurrencies: Why Nigeria is a global leader in Bitcoin trade - BBC
1031,North Macedonia crypto ownership numbers
1032,Global Cryptocurrency Ownership Data 2021 - TripleA
1033,Cryptos have robust potential in key Balkan markets | Emerald Insight
1034,Bitcoin ban: These are the countries where crypto is restricted or illegal
1035,Cryptocurrency Statistics 2022: Investing In Crypto - Bankrate.com
1036,[PDF] Cryptocurrencies: Tracing the Evolution of Criminal Finances - Europol
1037,Macedonia Home Ownership Rate - 2022 Data - 2023 Forecast
1038,Legality of cryptocurrency by country or territory - Wikipedia
1039,The Complete Guide to Cryptocurrency Statistics for August 2022
1040,The meteoric rise of cryptocurrency - KPMG United Arab Emirates
1041,75 Cryptocurrency Statistics Show Crypto's Gone Mainstream
1042,Norway crypto ownership numbers
1043,[PDF] ey-norwegian-crypto-adoption-survey-v2.pdf
1044,Crypto Ownership Among Norwegian Women Doubles in a Year
1045,"Crypto ownership among Norwegian women doubles, mirroring ..."
1046,• Norway: ownership of cryptocurrency by age group 2017 | Statista
1047,The number of female crypto owners in Norway doubled since 2021
1048,What Is Behind Norway's Booming Bitcoin And Crypto Interest?
1049,Cryptocurrency Demographics in Norway - BitGate
1050,2× Increment In Numbers Of Crypto Holders In Norway Over 2018 ...
1051,The Number Of Norwegian Women Who Hold Cryptocurrency Has ...
1052,Oman crypto ownership numbers
1053,Global Cryptocurrency Ownership Data 2021 - TripleA
1054,How to Buy Bitcoin in Oman in August 2022 - Business 2 Community
1055,[PDF] Regulation of Cryptocurrency Around the World: November 2021 ...
1056,Crypto is fully banned in China and 8 other countries - Fortune
1057,Morocco tops Arab world in terms of crypto owners followed by Egypt
1058,[PDF] Cryptocurrency Regulations: Institutions and Financial Openness
1059,Factors Influencing Bitcoin Investment Intention: The case of Oman
1060,Top ten companies with most bitcoin hold over 204000 in total
1061,Finder's Poll Shows Vietnam Holds the Highest Percentage of ...
1062,Pakistan crypto ownership numbers
1063,Cryptocurrency Ownership Data for India 2021 - TripleA
1064,Pakistan ranks third in Global Crypto Adoption Index
1065,The Raging Crypto Mania in Pakistan - The Geopolitics
1066,This map shows where cryptocurrency is taking off around the world
1067,The great potential of cryptocurrencies in Pakistan - Geo.tv
1068,2021 Global Crypto Adoption Index Up 880% - Chainalysis Blog
1069,Nearly half of crypto owners first bought digital assets in 2021: Study
1070,Crypto countries: Tracking global interest in cryptocurrencies
1071,Pakistan plans crypto ban; industry players call it big mistake
1072,Panama crypto ownership numbers
1073,Global Cryptocurrency Ownership Data 2021 - TripleA
1074,Crypto Ownership Data for Colombia 2021 - TripleA
1075,One Of Panama's Largest Banks Just Became Bitcoin Friendly
1076,Crypto millionaires building their own cities in Central America
1077,New Bitcoin law sees Panama join crypto nation A-list - Exodus Wallet
1078,The Best Global Crypto Exchanges - Forbes
1079,Blockchain and Cryptocurrencies in Panama
1080,Top ten companies with most bitcoin hold over 204000 in total
1081,What impact has bitcoin had on Panama's tourism industry?
1082,Papua New Guinea crypto ownership numbers
1083,Papua New Guinea and Cryptocurrency - Freeman Law
1084,Papua New Guinea - 2022 Data 2023 Forecast 2015 Historical
1085,Papua New Guinea - 2022 Data 2023 Forecast 2015 Historical
1086,Young Bitcoin entrepreneur brings Silicon Valley to Papua New ...
1087,[PDF] Cryptocurrency Regulations: Institutions and Financial Openness
1088,The Global Findex Database 2021 - World Bank Group
1089,Digital agriculture transforms farmers lives in Papua New Guinea - ITU
1090,[PDF] Digital Transformation: - GSMA
1091,Paraguay crypto ownership numbers
1092,Global Cryptocurrency Ownership Data 2021 - TripleA
1093,Paraguay Eyes Crypto Regulations in 2022 - PYMNTS.com
1094,"Paraguay: Bitcoin Mining, a Multinational Technology Company and ..."
1095,Is Paraguay set to make Bitcoin legal tender? Don't bet on it
1096,[PDF] The 2020 Geography of Cryptocurrency Report - Gov.bc.ca
1097,Should Paraguay invest its energy wealth in bitcoin 'mining' or ...
1098,IMF warns against using crypto as national currency ahead of El ...
1099,Sticking To The Regulated Path For Bitcoin In Paraguay
1100,Bitcoin ban: These are the countries where crypto is restricted or illegal
1101,Peru crypto ownership numbers
1102,Global Cryptocurrency Ownership Data 2021 - TripleA
1103,What countries use cryptocurrency the most? | World Economic Forum
1104,Which Countries Are Using Cryptocurrency the Most? - Yahoo Finance
1105,How Many People Own Bitcoin? 95 Blockchain Statistics (2022)
1106,[PDF] Cryptocurrency regulations by country - Thomson Reuters
1107,[PDF] Compendium – Cryptocurrency regulations by country
1108,Top 5 Countries Adopting Crypto and How BUSD Helps - Binance
1109,"2022, the year of the crypto economy in Latin America - RSM Global"
1110,Philippines crypto ownership numbers
1111,Cryptocurrency Ownership Data for Philippines 2021 - TripleA
1112,Transaction volume of cryptocurrency Philippines 2019-2020 - Statista
1113,Finder Cryptocurrency Adoption Index - finder Philippines
1114,Is the Philippines losing the cryptocurrency awareness race?
1115,Report: PH ranks 2nd in 'ownership of cryptocurrency' - Yahoo News
1116,PHL tops NFT ownership out of 20 countries — Finder
1117,"Philippines gets new government, will new crypto taxes follow?"
1118,What countries use cryptocurrency the most? | World Economic Forum
1119,Poland crypto ownership numbers
1120,Share of people investing in cryptocurrency in Poland 2018-2021
1121,"Most popular cryptocurrencies in Poland 2021, by type - Statista"
1122,"How Many People Own, Hold & Use Bitcoins? (2022)"
1123,The Condition of the Cryptocurrency Market and Exchanges in Poland
1124,[PDF] Cryptocurrency market in Poland and its institutional conditions
1125,Ransomware: Paying Cyber Extortion Demands in Cryptocurrency
1126,Why criminals can't hide behind Bitcoin | Science | AAAS
1127,2021 Global Crypto Adoption Index Up 880% - Chainalysis Blog
1128,Portugal crypto ownership numbers
1129,Global Cryptocurrency Ownership Data 2021 - TripleA
1130,"Bitcoin Family moves to Portugal, crypto tax haven - CNBC"
1131,Why 'crypto families' are flocking to Portugal - Sifted
1132,10% of the global population owns cryptocurrency
1133,How Portugal became Europe's accidental 'bitcoin heaven'
1134,House Sold In Portugal For 3 Bitcoin In Country's First-Ever Direct ...
1135,Blockchain & Cryptocurrency Laws and Regulations | Portugal | GLI
1136,Portugal for Crypto Traders: The Ultimate Guide | Get Golden Visa
1137,[PDF] Cryptocurrency regulations by country - Thomson Reuters
1138,Puerto Rico crypto ownership numbers
1139,"Puerto Rico: low taxes, island life make it hot for bitcoin fans - CNBC"
1140,Tax Breaks for Crypto Millionaires Stir Outrage in Puerto Rico
1141,Making a Crypto Utopia in Puerto Rico - The New York Times
1142,Crypto millionaires building their own cities in Central America
1143,'Crypto colonizers' in Puerto Rico try to sell locals on the dream
1144,Tax officials tighten their grip on crypto - Financial Times
1145,Why are cryptocurrency evangelists flocking to Puerto Rico?
1146,Mayors: Cryptocurrency won't solve your cities' problems
1147,Qatar crypto ownership numbers
1148,Global Cryptocurrency Ownership Data 2021 - TripleA
1149,Cryptocurrency Statistics 2022: Investing In Crypto - Bankrate.com
1150,"Qatar exploring blockchain despite 'no interest' in Crypto, wealth ..."
1151,Governance in the era of Blockchain technology in Qatar: a roadmap ...
1152,50 Cryptocurrency Statistics Every Investor Needs to Know
1153,This football-based token skyrockets 3100% in just 24 hours
1154,Trade finance in Qatar: blockchain and economic diversification
1155,Qatar and Cryptocurrency - Freeman Law
1156,[PDF] Regulation of Cryptocurrency Around the World: November 2021 ...
1157,Romania crypto ownership numbers
1158,Cryptocurrency ownership in Romania 2018 - Statista
1159,Romania: search interest for cryptocurrency by type 2021 - Statista
1160,FEATURE-Bitcoin catches on in tech-savvy Romania | Reuters
1161,Romania Home Ownership Rate - 2022 Data - 2023 Forecast
1162,Best Crypto Exchange in Romania 2022 - Business 2 Community
1163,How to Buy Bitcoin in Romania in July 2022 - Business 2 Community
1164,[PDF] UNCTAD Policy Brief No. 100
1165,Bitcoin ban: These are the countries where crypto is restricted or illegal
1166,Russia crypto ownership numbers
1167,Russians own 12% of the world's crypto assets - Times of India
1168,Russia Values Local Crypto at $200 Billion as Rules Near
1169,"Cryptocurrency ownership distribution in Russia in 2020, by age"
1170,"Russians Collectively Own Over $130 Billion Worth of Crypto, Prime ..."
1171,Russia Crypto Adoption Statistics— Data Shows Staggering Crypto ...
1172,Russia Accounts for $214 Billion of Cryptocurrency ... - ETF Trends
1173,Russia Accounts for $214 Billion of Cryptocurrency ... - Yahoo Finance
1174,Could Russia Potentially Use Cryptocurrency to Circumvent ...
1175,Rwanda crypto ownership numbers
1176,Global Cryptocurrency Ownership Data 2021 - TripleA
1177,[PDF] THE RWANDAN BANKER - National Bank of Rwanda
1178,(PDF) Rwandacoin: Prospects and challenges of developing a ...
1179,[PDF] BLOCKCHAIN IN AFRICA: - GIZ
1180,INSIGHT-How bitcoin met the real world in Africa | Reuters
1181,[PDF] Cryptocurrency Regulations: Institutions and Financial Openness
1182,'Crypto Continent': The rise of African blockchain startups - TRT World
1183,Cryptocurrencies - On the cusp of mainstream? - Mercer
1184,Why criminals can't hide behind Bitcoin | Science | AAAS
1185,Saudi Arabia crypto ownership numbers
1186,Survey reveals high penetration and adoption of crypto in Saudi ...
1187,Saudis come third among Arab cryptocurrency owners - ZAWYA
1188,Saudis come third among Arab cryptocurrency owners
1189,Survey reveals high penetration and adoption of ... - Forbes India
1190,KuCoin Into The Cryptoverse Reveals Increase In ... - Business Wire
1191,"Study: 14% of Saudis Are Crypto Investors, 76% Have Less Than ..."
1192,Crypto stats: Adoption in Saudi; Solana and more! - BitOasis Blog
1193,Saudis rank third among Arab cryptocurrency owners - Gulf Insider
1194,KuCoin Into The Cryptoverse Reveals Increase In ... - Financial Post
1195,Senegal crypto ownership numbers
1196,Global Cryptocurrency Ownership Data 2021 - TripleA
1197,INSIGHT-How bitcoin met the real world in Africa | Reuters
1198,Akon: Why crypto could transform Africa's future - Fortune
1199,[PDF] Regulation of Cryptocurrency Around the World: November 2021 ...
1200,This map shows where cryptocurrency is taking off around the world
1201,"Crypto users in Africa grew by 2,500% in 2021: Report - Cointelegraph"
1202,Jurisdictions under Increased Monitoring - June 2021 - FATF
1203,Jurisdictions under Increased Monitoring - March 2022 - FATF
1204,The Bitcoin Whales: 1000 People Who Own 40 Percent of the Market
1205,Serbia crypto ownership numbers
1206,"Crypto Owners in Serbia Reach 200,000 as Country Regulates ..."
1207,The number of Crypto Owners in Serbia has reached 200000 - Reddit
1208,"Crypto Owners In Serbia Reach 200,000 As Country ... - TittlePress"
1209,"As the state regulates digital assets, the number of cryptocurrency ..."
1210,Cryptocurrency Regulations in Serbia | Legal Consultation Guide
1211,[PDF] Regulation of Cryptocurrency Around the World: November 2021 ...
1212,Best Crypto Exchange in Serbia for August 2022
1213,How to Buy Bitcoin in Serbia in July 2022 - Business 2 Community
1214,Seychelles crypto ownership numbers
1215,Global Cryptocurrency Ownership Data 2021 - TripleA
1216,"Seychelles, Longtime Home of BitMEX, Is Bending to US ... - CoinDesk"
1217,[PDF] Technology and Innovation Offshore Guide - Appleby
1218,The Best Global Crypto Exchanges - Forbes
1219,Offshore cryptocurrency exchange obtains clarity from the English ...
1220,KuCoin Into The Cryptoverse Reveals Increase In Number of Saudi ...
1221,Seychelles bird made 'digital species' for conservation
1222,[PDF] Seychelles Crypto Company Invoice | Healy Consultants
1223,Crypto exchanges resist calls for ban on Russia transactions
1224,Singapore crypto ownership numbers
1225,"Cryptocurrency ownership Singapore 2021, by coin - Statista"
1226,"Cryptocurrency ownership Singapore 2021, by age group - Statista"
1227,Cryptocurrency Ownership Data for Singapore 2022 - TripleA
1228,Nearly 16% of Singaporeans surveyed currently own cryptocurrency
1229,Singapore posts slight drop in cryptocurrency ownership
1230,Singapore clinches 10th spot as most crypto aware country
1231,Bitcoin Awareness And Adoption In Singapore Is Huge - Nasdaq
1232,Singapore crypto take-up reaches 43% of adults - Forkast News
1233,Global crypto awareness: Singapore beats Canada and Hong Kong
1234,Slovakia crypto ownership numbers
1235,Global Cryptocurrency Ownership Data 2021 - TripleA
1236,[PDF] Overview of the crypto assets market in Slovakia
1237,"Slovakia Crypto License (45,900 EUR)"
1238,How are cryptocurrencies regulated in Slovakia? - Blockpit
1239,[PDF] The 2020 Geography of Cryptocurrency Report - Gov.bc.ca
1240,[PDF] Regulation of Cryptocurrency Around the World: November 2021 ...
1241,Best Crypto Exchanges in Slovakia 2022 - Business 2 Community
1242,Cryptocurrency and its legal status according to Slovak law
1243,Slovenia crypto ownership numbers
1244,Global Cryptocurrency Ownership Data 2021 - TripleA
1245,Crypto Adoption Soars in Slovenia: Over 1000 Locations Accept ...
1246,Slovenia - Cryptocurrency Laws and Regulation - Freeman Law
1247,"Ljubljana Is Named For Europe's Most Crypto-Friendly City, Here's ..."
1248,GoCrypto Celebrates as Ljubljana Ranked Most Crypto-Friendly City ...
1249,Crypto countries: Tracking global interest in cryptocurrencies
1250,[DOC] Tax treatment of activities with virtual currencies as per ZDoh-2 ...
1251,[PDF] Regulation of Cryptocurrency Around the World: November 2021 ...
1252,South Africa crypto ownership numbers
1253,South Africa tops the list of cryptocurrency ownership among global ...
1254,Cryptocurrency ownership in SA below global average - Moonstone
1255,Crypto Adoption trends in South Africa and world in 2022
1256,Survey: Proportion of South African Crypto Holders Grows to 11.3 ...
1257,Report: South Africa ranks 21st in crypto ownership
1258,Research gives some idea about how much South Africa's ...
1259,Cryptocurrency Ownership Data for Nigeria 2021 - TripleA
1260,Cryptocurrency adoption by country 2019-2021 - Statista
1261,[PDF] Blockchain and Cryptocurrency in Africa - Baker McKenzie
1262,South Korea crypto ownership numbers
1263,Cryptocurrency Ownership Data for South Korea 2022 - TripleA
1264,"Cryptocurrency ownership South Korea 2021, by type - Statista"
1265,Number of users of leading crypto exchanges South Korea 2021
1266,South Korea Probes $3.4 Billion of Crypto-linked FX Transactions
