,0
1266,"Cryptocurrency ownership South Korea 2021, by type - Statista"
1267,Number of users of leading crypto exchanges South Korea 2021
1268,South Korea Probes $3.4 Billion of Crypto-linked FX Transactions
1269,S. Korea's crypto assets exceed W55tr - The Korea Herald
1270,South Korea Crypto Regulations - Coinfirm
1271,Financial Services Commission - 금융위원회
1272,Bank of Korea
1273,South Korea Home Ownership Rate - 2022 Data - Trading Economics
1274,The New Crypto Regulations in South Korea - Sumsub
1275,Spain crypto ownership numbers
1276,Global Cryptocurrency Ownership Data 2021 - TripleA
1277,[PDF] Crypto-assets. Financial Stability Report. Spring 2022.
1278,[PDF] Cryptocurrency adoption rates - Finder - 3 Bit Lab
1279,Cryptos on the rise 2022 | Thomson Reuters
1280,[PDF] Cryptocurrency regulations by country - Thomson Reuters
1281,Blockchain & Cryptocurrency Laws and Regulations | Spain | GLI
1282,For a few cryptos more: the Wild West of crypto finance
1283,Decrypting financial stability risks in crypto-asset markets
1284,Sri Lanka crypto ownership numbers
1285,Suriname crypto ownership numbers
1286,Sweden crypto ownership numbers
1287,Switzerland crypto ownership numbers
1288,Syria crypto ownership numbers
1289,Tajikistan crypto ownership numbers
1290,Tanzania crypto ownership numbers
1291,Thailand crypto ownership numbers
1292,Togo crypto ownership numbers
1293,Trinidad and Tobago crypto ownership numbers
1294,Tunisia crypto ownership numbers
1295,Turkey crypto ownership numbers
1296,Turkmenistan crypto ownership numbers
1297,Uganda crypto ownership numbers
1298,Ukraine crypto ownership numbers
1299,United Arab Emirates crypto ownership numbers
1300,United Kingdom crypto ownership numbers
1301,United States crypto ownership numbers
1302,Uruguay crypto ownership numbers
1303,Uzbekistan crypto ownership numbers
1304,Venezuela crypto ownership numbers
1305,Vietnam crypto ownership numbers
1306,"Virgin Islands , U.S. crypto ownership numbers"
1307,Zambia crypto ownership numbers
1308,Zimbabwe crypto ownership numbers
