,0
852,Why criminals can't hide behind Bitcoin | Science | AAAS
853,Digital 2022: Big Rise in Cryptocurrency Ownership - DataReportal
854,The Business Benefit of Using Cryptocurrency | Deloitte US
855,Corporates investing in crypto | Deloitte US
856,"India, Maldives sign six pacts; widen defence partnership"
857,How Many People Own Bitcoin? 95 Blockchain Statistics (2022)
858,Global Financial Crisis - an overview | ScienceDirect Topics
859,Mali crypto ownership numbers
860,Global Cryptocurrency Ownership Data 2021 - TripleA
861,INSIGHT-How bitcoin met the real world in Africa | Reuters
862,Crypto's Greatest Challenge: Legitimacy or Acceptance?
863,Cryptocurrencies and blockchain - World Bank Documents
864,Bitcoin Awareness And Adoption In Singapore Is Huge - Nasdaq
865,Survey Reveals Shifts In Bitcoin Ownership Demographics
866,[PDF] BLOCKCHAIN IN AFRICA: - GIZ
867,How Many People Own Bitcoin? 95 Blockchain Statistics (2022)
868,Mali | Private Sector | World Bank Development Indicators
869,Malta crypto ownership numbers
870,Global Cryptocurrency Ownership Data 2021 - TripleA
871,Is Malta the domicile of choice for crypto-millionaires?
872,How Malta's System Is Embracing The Crypto Revolution
873,Bitcoin ownership among US crypto owners at 81% in March 2021 ...
874,"[PDF] Crypto-assets - Key developments, regulatory concerns and ..."
875,Cryptocurrency Regulations Around The World - ComplyAdvantage
876,[PDF] GLOBAL CRYPTOASSET REGULATORY LANDSCAPE STUDY
877,How Malta Is Becoming the Blockchain Hub of the World
878,10 Cities That Are Bitcoin Hotspots - Investopedia
879,Mauritius crypto ownership numbers
880,Global Cryptocurrency Ownership Data 2021 - TripleA
881,[PDF] taxation of bitcoin transactions in mauritius: a comparative study with ...
882,[PDF] Blockchain and Cryptocurrency in Africa - Baker McKenzie
883,[PDF] Regulation of Cryptocurrency Around the World: November 2021 ...
884,Cryptocurrency - Developments In Mauritius - Fin Tech - Mondaq
885,Mauritius Releases Guidance for Regulated Security Token Offerings
886,Mauritius Home Ownership Rate - 2022 Data - 2023 Forecast
887,Top ten companies with most bitcoin hold over 204000 in total
888,Mauritius Trails Peers in Race to Pre-Covid Tourist Numbers
889,Mexico crypto ownership numbers
890,Global Cryptocurrency Ownership Data 2021 - TripleA
891,Finder Cryptocurrency Adoption Index | finder.com
892,What countries use cryptocurrency the most? | World Economic Forum
893,[PDF] Cryptocurrency regulations by country - Thomson Reuters
894,[PDF] The 2020 Geography of Cryptocurrency Report - Gov.bc.ca
895,[PDF] Cryptocurrency adoption rates - Finder - 3 Bit Lab
896,"India Tops List Of 27 Nations Surveyed For Crypto Ownership, Says ..."
897,Cryptocurrency Regulations Around The World - ComplyAdvantage
898,"Moldova, Republic of crypto ownership numbers"
899,Global Cryptocurrency Ownership Data 2021 - TripleA
900,"TripleA - Accept Crypto Payments, Grow Your Business"
901,(PDF) Blockchain and Bitcoin as a Way to Lift a Country out of Poverty
902,[PDF] Regulation of Cryptocurrency Around the World: November 2021 ...
903,Cryptocurrencies - On the cusp of mainstream? - Mercer
904,Top ten companies with most bitcoin hold over 204000 in total
905,Is the acceleration of institutional cryptocurrency adoption ...
906,[PDF] Republic of Moldova 2018 - Flanders Investment and Trade
907,[PDF] Moneyval-Mutual-Evaluation-Report-Moldova-2019.pdf - FATF
908,Monaco crypto ownership numbers
909,Global Cryptocurrency Ownership Data 2021 - TripleA
910,Crypto Visa card company Monaco just spent millions ... - TechCrunch
911,Crypto.com - Wikipedia
912,Cryptos on the rise 2022 | Thomson Reuters
913,Crypto.com Spent Its Way to the Top. Then the Market Crashed. Now ...
914,Crypto.com - Crunchbase Company Profile & Funding
915,Financial Crime Outlook: 2022 and beyond | Monaco | Global law ...
916,"Monaco Planet, a new generation of SocialFi platform to Launch on ..."
917,Cryptocurrency Platform Monaco Purchases the Domain Name ...
918,Mongolia crypto ownership numbers
919,Mongolia is leading the world in cryptocurrency adoption
920,[PDF] The 2020 Geography of Cryptocurrency Report - Gov.bc.ca
921,China's Inner Mongolia to Ban Bitcoin Mining - Decrypt
922,China's underground bitcoin miners - CNBC
923,Bitcoin mining is still huge in China despite new ban in Inner Mongolia
924,Top ten companies with most bitcoin hold over 204000 in total
925,Opinion: China's bitcoin crackdown is not its final act | IFLR
926,The Political Geography and Environmental Impacts of ...
927,Montenegro crypto ownership numbers
928,Global Cryptocurrency Ownership Data 2021 - TripleA
929,"In Montenegro, 1,6% of the population owns cryptocurrency"
930,"Montenegro, the Most Underrated Crypto Jurisdiction"
931,[PDF] Regulation of Cryptocurrency Around the World: November 2021 ...
932,Top ten companies with most bitcoin hold over 204000 in total
933,Crypto License in Montenegro – Get Help from Our Incorporation ...
934,Vitalik Buterin Becomes a Citizen of Montenegro - DailyCoin
935,Why criminals can't hide behind Bitcoin | Science | AAAS
936,Digital 2022 Montenegro (February 2022) v01 - SlideShare
937,Morocco crypto ownership numbers
938,The status of cryptocurrency in Morocco - ScienceDirect.com
939,Morocco tops Arab world in terms of crypto owners followed by Egypt
940,Morocco is number one for Bitcoin trading in North Africa
941,A Report Reveals The Number Of Bitcoin Owners In Morocco... And ...
942,Morocco Remains An African Crypto 'Trading Hub' Despite State Ban
943,[PDF] Cryptocurrency regulations by country - Thomson Reuters
944,Crypto stats: Adoption in Saudi; Solana and more! - BitOasis Blog
945,Saudis come third among Arab cryptocurrency owners
946,Mozambique crypto ownership numbers
947,Global Cryptocurrency Ownership Data 2021 - TripleA
948,INSIGHT-How bitcoin met the real world in Africa | Reuters
949,Cryptocurrencies and blockchain - World Bank Documents
950,This map shows where cryptocurrency is taking off around the world
951,The Role of Market Surveillance: Building Trust in Crypto Markets
952,How Many People Own Bitcoin? 95 Blockchain Statistics (2022)
953,"Mozambique acquisition: Latest News & Videos, Photos about ..."
954,Company Search Page - SEC.gov
955,EDGAR Full Text Search - SEC.gov
956,Myanmar crypto ownership numbers
957,Global Cryptocurrency Ownership Data 2021 - TripleA
958,Myanmar's NUG looks to cryptocurrencies in bid to raise US$1 ...
959,Myanmar: Casino Cities Run on Blockchain Threaten Nation's ...
960,"Crypto, Soros and the Global Drive to Fund Revolution in Myanmar"
961,Myanmar Planning Digital Currency to Aid Economy - PYMNTS.com
962,[PDF] Blockchain for digital government - Draft A - ASEAN
963,Myanmar holds its first blockchain roundtable
964,The Global Findex Database 2021 - World Bank Group
965,Why criminals can't hide behind Bitcoin | Science | AAAS
966,Namibia crypto ownership numbers
967,Global Cryptocurrency Ownership Data 2021 - TripleA
968,[PDF] Blockchain and Cryptocurrency in Africa - Baker McKenzie
969,Crypto-currency adoption in Africa: The ups and downs
970,For a few cryptos more: the Wild West of crypto finance
971,Namibian Bitcoin Trading Platform BTN Trudges on Despite Partial ...
972,Top ten companies with most bitcoin hold over 204000 in total
973,Why criminals can't hide behind Bitcoin | Science | AAAS
974,What countries use cryptocurrency the most? | World Economic Forum
975,2021 Investment Climate Statements: Namibia - Department of State
976,Nepal crypto ownership numbers
977,Global Cryptocurrency Ownership Data 2021 - TripleA
978,Crypto Currency And Its Effect In Nepal | New Spotlight Magazine
979,Cryptocurrency Statistics 2022: Investing In Crypto - Bankrate.com
980,[PDF] UNCTAD Policy Brief No. 100
981,[PDF] Cryptocurrency Regulations: Institutions and Financial Openness
982,[PDF] Regulation of Cryptocurrency Around the World: November 2021 ...
983,For a few cryptos more: the Wild West of crypto finance
984,Bitcoin ban: These are the countries where crypto is restricted or illegal
985,"Crypto and the Dollar Are Partners, Not Rivals - Bloomberg.com"
986,Netherlands crypto ownership numbers
987,"Netherlands: ownership of cryptocurrencies, by type 2018 - Statista"
988,"Netherlands: ownership of cryptocurrencies, by gender 2018 - Statista"
989,Travel Rule Crypto in Netherlands by DNB [2021] - Notabene
990,Dutch regulators unsure of number of crypto investors in Netherlands
991,Cryptos on the rise 2022 | Thomson Reuters
992,How Many People Own Bitcoin? 95 Blockchain Statistics (2022)
993,Why criminals can't hide behind Bitcoin | Science | AAAS
994,Crypto countries: Tracking global interest in cryptocurrencies
995,New Caledonia crypto ownership numbers
996,New Caledonia Home Ownership Rate - 2022 Data - 2023 Forecast
997,Global Cryptocurrency Ownership Data 2021 - TripleA
998,Cryptocurrencies - On the cusp of mainstream? - Mercer
999,Why criminals can't hide behind Bitcoin | Science | AAAS
1000,Crypto in focus as FTX buys BlockFi and Voyager Digital halts ...
1001,Bitcoin Awareness And Adoption In Singapore Is Huge - Nasdaq
1002,Top ten companies with most bitcoin hold over 204000 in total
1003,New Caledonia - Mazars Group
1004,Top Nickel Miner Vale Turns Page on 14-Year Caledonian Foray
1005,New Zealand crypto ownership numbers
1006,Global Cryptocurrency Ownership Data 2021 - TripleA
1007,"Cryptocurrency trading in NZ below world average, but signs show ..."
1008,[PDF] Crypto-currencies – An introduction to not-so-funny moneys
1009,[PDF] How many active crypto traders are there across the globe?
1010,Cryptos on the rise 2022 | Thomson Reuters
1011,[PDF] Cryptocurrency regulations by country - Thomson Reuters
1012,"63+ Cryptocurrency Statistics, Facts & Trends - Buy Bitcoin Worldwide"
1013,Crypto countries: Tracking global interest in cryptocurrencies
1014,Nicaragua crypto ownership numbers
1015,Global Cryptocurrency Ownership Data 2021 - TripleA
1016,"TripleA - Accept Crypto Payments, Grow Your Business"
1017,Man Uses Bitcoin to Buy a Piece of Paradise in Nicaragua - CoinDesk
1018,Legality of cryptocurrency by country or territory - Wikipedia
1019,Why criminals can't hide behind Bitcoin | Science | AAAS
1020,Nicaragua Goes After Newspaper for Reporting Nuns' Explusion
1021,The Business Benefit of Using Cryptocurrency | Deloitte US
1022,Nicaragua | Private Sector | World Bank Development Indicators
1023,Nicaragua - Start-up Procedures To Register A Business - 2022 ...
1024,Nigeria crypto ownership numbers
1025,Finder Survey: Nigeria's 24.2% Adoption Rating Is the Highest Rate ...
1026,"Nigeria ranks ahead of U.S., others in crypto ownership. Bitcoin ..."
1027,Crypto trading is surging in Nigeria despite a government ban ...
1028,"India Tops List Of 27 Nations Surveyed For Crypto Ownership, Says ..."
1029,Lack of proper financial services boosts crypto ownership in Nigeria ...
1030,Finder Cryptocurrency Adoption Index - finder Nigeria
1031,What countries use cryptocurrency the most? | World Economic Forum
1032,Cryptocurrencies: Why Nigeria is a global leader in Bitcoin trade - BBC
1033,North Macedonia crypto ownership numbers
1034,Global Cryptocurrency Ownership Data 2021 - TripleA
1035,Cryptos have robust potential in key Balkan markets | Emerald Insight
1036,Bitcoin ban: These are the countries where crypto is restricted or illegal
1037,Cryptocurrency Statistics 2022: Investing In Crypto - Bankrate.com
1038,[PDF] Cryptocurrencies: Tracing the Evolution of Criminal Finances - Europol
1039,Macedonia Home Ownership Rate - 2022 Data - 2023 Forecast
1040,Legality of cryptocurrency by country or territory - Wikipedia
1041,The Complete Guide to Cryptocurrency Statistics for August 2022
1042,The meteoric rise of cryptocurrency - KPMG United Arab Emirates
1043,75 Cryptocurrency Statistics Show Crypto's Gone Mainstream
1044,Norway crypto ownership numbers
1045,[PDF] ey-norwegian-crypto-adoption-survey-v2.pdf
1046,Crypto Ownership Among Norwegian Women Doubles in a Year
1047,"Crypto ownership among Norwegian women doubles, mirroring ..."
1048,• Norway: ownership of cryptocurrency by age group 2017 | Statista
1049,The number of female crypto owners in Norway doubled since 2021
1050,What Is Behind Norway's Booming Bitcoin And Crypto Interest?
1051,2× Increment In Numbers Of Crypto Holders In Norway Over 2018 ...
1052,Cryptocurrency Demographics in Norway - BitGate
1053,Blockchain & Cryptocurrency Laws and Regulations | Norway | GLI
1054,Oman crypto ownership numbers
1055,Global Cryptocurrency Ownership Data 2021 - TripleA
1056,How to Buy Bitcoin in Oman in August 2022 - Business 2 Community
1057,[PDF] Regulation of Cryptocurrency Around the World: November 2021 ...
1058,Crypto is fully banned in China and 8 other countries - Fortune
1059,Morocco tops Arab world in terms of crypto owners followed by Egypt
1060,Finder's Poll Shows Vietnam Holds the Highest Percentage of ...
1061,[PDF] Cryptocurrency Regulations: Institutions and Financial Openness
1062,Factors Influencing Bitcoin Investment Intention: The case of Oman
1063,Top ten companies with most bitcoin hold over 204000 in total
1064,Pakistan crypto ownership numbers
1065,Cryptocurrency Ownership Data for India 2021 - TripleA
1066,Pakistan ranks third in Global Crypto Adoption Index
1067,The Raging Crypto Mania in Pakistan - The Geopolitics
1068,This map shows where cryptocurrency is taking off around the world
1069,The great potential of cryptocurrencies in Pakistan - Geo.tv
1070,2021 Global Crypto Adoption Index Up 880% - Chainalysis Blog
1071,Nearly half of crypto owners first bought digital assets in 2021: Study
1072,Crypto countries: Tracking global interest in cryptocurrencies
1073,Pakistan plans crypto ban; industry players call it big mistake
1074,Panama crypto ownership numbers
1075,Global Cryptocurrency Ownership Data 2021 - TripleA
1076,Crypto Ownership Data for Colombia 2021 - TripleA
1077,One Of Panama's Largest Banks Just Became Bitcoin Friendly
1078,Crypto millionaires building their own cities in Central America
1079,New Bitcoin law sees Panama join crypto nation A-list - Exodus Wallet
1080,The Best Global Crypto Exchanges - Forbes
1081,Blockchain and Cryptocurrencies in Panama
1082,Top ten companies with most bitcoin hold over 204000 in total
1083,What impact has bitcoin had on Panama's tourism industry?
1084,Papua New Guinea crypto ownership numbers
1085,Papua New Guinea and Cryptocurrency - Freeman Law
1086,Papua New Guinea - 2022 Data 2023 Forecast 2015 Historical
1087,Papua New Guinea - 2022 Data 2023 Forecast 2015 Historical
1088,Young Bitcoin entrepreneur brings Silicon Valley to Papua New ...
1089,[PDF] Cryptocurrency Regulations: Institutions and Financial Openness
1090,The Global Findex Database 2021 - World Bank Group
1091,[PDF] Digital Transformation: - GSMA
1092,[PDF] Charting your path - Doing business in Papua New Guinea May 2022
1093,Paraguay crypto ownership numbers
1094,Global Cryptocurrency Ownership Data 2021 - TripleA
1095,Paraguay Eyes Crypto Regulations in 2022 - PYMNTS.com
1096,"Paraguay: Bitcoin Mining, a Multinational Technology Company and ..."
1097,Is Paraguay set to make Bitcoin legal tender? Don't bet on it
1098,[PDF] The 2020 Geography of Cryptocurrency Report - Gov.bc.ca
1099,Should Paraguay invest its energy wealth in bitcoin 'mining' or ...
1100,IMF warns against using crypto as national currency ahead of El ...
1101,Sticking To The Regulated Path For Bitcoin In Paraguay
1102,Bitcoin ban: These are the countries where crypto is restricted or illegal
1103,Peru crypto ownership numbers
1104,What countries use cryptocurrency the most? | World Economic Forum
1105,Which Countries Are Using Cryptocurrency the Most? - Yahoo Finance
1106,How Many People Own Bitcoin? 95 Blockchain Statistics (2022)
1107,[PDF] Cryptocurrency regulations by country - Thomson Reuters
1108,Cryptos on the rise 2022 | Thomson Reuters
1109,Top 5 Countries Adopting Crypto and How BUSD Helps - Binance
1110,"2022, the year of the crypto economy in Latin America - RSM Global"
1111,44 Amazing Cryptocurrency Statistics You Need to Know - Techjury
1112,Philippines crypto ownership numbers
1113,Cryptocurrency Ownership Data for Philippines 2021 - TripleA
1114,Transaction volume of cryptocurrency Philippines 2019-2020 - Statista
1115,Finder Cryptocurrency Adoption Index - finder Philippines
1116,Is the Philippines losing the cryptocurrency awareness race?
1117,Report: PH ranks 2nd in 'ownership of cryptocurrency' - Yahoo News
1118,PHL tops NFT ownership out of 20 countries — Finder
1119,"Philippines gets new government, will new crypto taxes follow?"
1120,What countries use cryptocurrency the most? | World Economic Forum
1121,Poland crypto ownership numbers
1122,Share of people investing in cryptocurrency in Poland 2018-2021
1123,"Most popular cryptocurrencies in Poland 2021, by type - Statista"
1124,The Condition of the Cryptocurrency Market and Exchanges in Poland
1125,[PDF] Cryptocurrency market in Poland and its institutional conditions
1126,Ransomware: Paying Cyber Extortion Demands in Cryptocurrency
1127,Why criminals can't hide behind Bitcoin | Science | AAAS
1128,2021 Global Crypto Adoption Index Up 880% - Chainalysis Blog
1129,Best Crypto Exchange in Poland August 2022 - Business 2 Community
1130,Portugal crypto ownership numbers
1131,Global Cryptocurrency Ownership Data 2021 - TripleA
1132,"Bitcoin Family moves to Portugal, crypto tax haven - CNBC"
1133,Why 'crypto families' are flocking to Portugal - Sifted
1134,10% of the global population owns cryptocurrency
1135,How Portugal became Europe's accidental 'bitcoin heaven'
1136,House Sold In Portugal For 3 Bitcoin In Country's First-Ever Direct ...
1137,Blockchain & Cryptocurrency Laws and Regulations | Portugal | GLI
1138,Portugal for Crypto Traders: The Ultimate Guide | Get Golden Visa
1139,[PDF] Cryptocurrency regulations by country - Thomson Reuters
1140,Puerto Rico crypto ownership numbers
1141,"Puerto Rico: low taxes, island life make it hot for bitcoin fans - CNBC"
1142,Tax Breaks for Crypto Millionaires Stir Outrage in Puerto Rico
1143,Making a Crypto Utopia in Puerto Rico - The New York Times
1144,Crypto millionaires building their own cities in Central America
1145,'Crypto colonizers' in Puerto Rico try to sell locals on the dream
1146,Tax officials tighten their grip on crypto - Financial Times
1147,Why are cryptocurrency evangelists flocking to Puerto Rico?
1148,Mayors: Cryptocurrency won't solve your cities' problems
1149,Qatar crypto ownership numbers
1150,Global Cryptocurrency Ownership Data 2021 - TripleA
1151,Cryptocurrency Statistics 2022: Investing In Crypto - Bankrate.com
1152,"Qatar exploring blockchain despite 'no interest' in Crypto, wealth ..."
1153,Governance in the era of Blockchain technology in Qatar: a roadmap ...
1154,50 Cryptocurrency Statistics Every Investor Needs to Know
1155,This football-based token skyrockets 3100% in just 24 hours
1156,Trade finance in Qatar: blockchain and economic diversification
1157,Qatar and Cryptocurrency - Freeman Law
1158,[PDF] Regulation of Cryptocurrency Around the World: November 2021 ...
1159,Romania crypto ownership numbers
1160,Cryptocurrency ownership in Romania 2018 - Statista
1161,Romania: search interest for cryptocurrency by type 2021 - Statista
1162,FEATURE-Bitcoin catches on in tech-savvy Romania | Reuters
1163,Romania Home Ownership Rate - 2022 Data - 2023 Forecast
1164,Best Crypto Exchange in Romania 2022 - Business 2 Community
1165,How to Buy Bitcoin in Romania in July 2022 - Business 2 Community
1166,[PDF] UNCTAD Policy Brief No. 100
1167,Bitcoin ban: These are the countries where crypto is restricted or illegal
1168,Russia crypto ownership numbers
1169,Russians own 12% of the world's crypto assets - Times of India
1170,Russia Values Local Crypto at $200 Billion as Rules Near
1171,"Cryptocurrency ownership distribution in Russia in 2020, by age"
1172,"Russians Collectively Own Over $130 Billion Worth of Crypto, Prime ..."
1173,Russia Crypto Adoption Statistics— Data Shows Staggering Crypto ...
1174,Russia Accounts for $214 Billion of Cryptocurrency ... - ETF Trends
1175,Russia Accounts for $214 Billion of Cryptocurrency ... - Yahoo Finance
1176,Could Russia Potentially Use Cryptocurrency to Circumvent ...
1177,Rwanda crypto ownership numbers
1178,Global Cryptocurrency Ownership Data 2021 - TripleA
1179,[PDF] THE RWANDAN BANKER - National Bank of Rwanda
1180,(PDF) Rwandacoin: Prospects and challenges of developing a ...
1181,[PDF] BLOCKCHAIN IN AFRICA: - GIZ
1182,INSIGHT-How bitcoin met the real world in Africa | Reuters
1183,[PDF] Cryptocurrency Regulations: Institutions and Financial Openness
1184,'Crypto Continent': The rise of African blockchain startups - TRT World
1185,Cryptocurrencies - On the cusp of mainstream? - Mercer
1186,Why criminals can't hide behind Bitcoin | Science | AAAS
1187,Saudi Arabia crypto ownership numbers
1188,Survey reveals high penetration and adoption of crypto in Saudi ...
1189,Saudis come third among Arab cryptocurrency owners - ZAWYA
1190,Saudis come third among Arab cryptocurrency owners
1191,Survey reveals high penetration and adoption of ... - Forbes India
1192,"Study: 14% of Saudis Are Crypto Investors, 76% Have Less Than ..."
1193,KuCoin Into The Cryptoverse Reveals Increase In ... - Business Wire
1194,Crypto stats: Adoption in Saudi; Solana and more! - BitOasis Blog
1195,Saudis rank third among Arab cryptocurrency owners - Gulf Insider
1196,KuCoin Into The Cryptoverse Reveals Increase In ... - Financial Post
1197,Senegal crypto ownership numbers
1198,Global Cryptocurrency Ownership Data 2021 - TripleA
1199,INSIGHT-How bitcoin met the real world in Africa | Reuters
1200,Akon: Why crypto could transform Africa's future - Fortune
1201,This map shows where cryptocurrency is taking off around the world
1202,"Crypto users in Africa grew by 2,500% in 2021: Report - Cointelegraph"
1203,Jurisdictions under Increased Monitoring - June 2021 - FATF
1204,Jurisdictions under Increased Monitoring - March 2022 - FATF
1205,The Bitcoin Whales: 1000 People Who Own 40 Percent of the Market
1206,Building the Crypto Ecosystem in Senegal - Yellow Card
1207,Serbia crypto ownership numbers
1208,"Crypto Owners in Serbia Reach 200,000 as Country Regulates ..."
1209,The number of Crypto Owners in Serbia has reached 200000 - Reddit
1210,"Crypto Owners In Serbia Reach 200,000 As Country ... - TittlePress"
1211,"As the state regulates digital assets, the number of cryptocurrency ..."
1212,Cryptocurrency Regulations in Serbia | Legal Consultation Guide
1213,[PDF] Regulation of Cryptocurrency Around the World: November 2021 ...
1214,How to Buy Bitcoin in Serbia in July 2022 - Business 2 Community
1215,Best Crypto Exchange in Serbia for July 2022 - Business 2 Community
1216,Seychelles crypto ownership numbers
1217,Global Cryptocurrency Ownership Data 2021 - TripleA
1218,"Seychelles, Longtime Home of BitMEX, Is Bending to US ... - CoinDesk"
1219,[PDF] Technology and Innovation Offshore Guide - Appleby
1220,The Best Global Crypto Exchanges - Forbes
1221,Offshore cryptocurrency exchange obtains clarity from the English ...
1222,KuCoin Into The Cryptoverse Reveals Increase In Number of Saudi ...
1223,Seychelles bird made 'digital species' for conservation
1224,[PDF] Seychelles Crypto Company Invoice | Healy Consultants
1225,Crypto exchanges resist calls for ban on Russia transactions
1226,Singapore crypto ownership numbers
1227,"Cryptocurrency ownership Singapore 2021, by coin - Statista"
1228,"Cryptocurrency ownership Singapore 2021, by age group - Statista"
1229,Cryptocurrency Ownership Data for Singapore 2022 - TripleA
1230,Nearly 16% of Singaporeans surveyed currently own cryptocurrency
1231,Singapore posts slight drop in cryptocurrency ownership
1232,Singapore clinches 10th spot as most crypto aware country
1233,Bitcoin Awareness And Adoption In Singapore Is Huge - Nasdaq
1234,Singapore crypto take-up reaches 43% of adults - Forkast News
1235,Global crypto awareness: Singapore beats Canada and Hong Kong
1236,Slovakia crypto ownership numbers
1237,Global Cryptocurrency Ownership Data 2021 - TripleA
1238,[PDF] Overview of the crypto assets market in Slovakia
1239,"Slovakia Crypto License (45,900 EUR)"
1240,How are cryptocurrencies regulated in Slovakia? - Blockpit
1241,[PDF] The 2020 Geography of Cryptocurrency Report - Gov.bc.ca
1242,[PDF] Regulation of Cryptocurrency Around the World: November 2021 ...
1243,Best Crypto Exchanges in Slovakia 2022 - Business 2 Community
1244,Cryptocurrency and its legal status according to Slovak law
1245,Slovenia crypto ownership numbers
1246,Global Cryptocurrency Ownership Data 2021 - TripleA
1247,Crypto Adoption Soars in Slovenia: Over 1000 Locations Accept ...
1248,"Ljubljana Is Named For Europe's Most Crypto-Friendly City, Here's ..."
1249,Crypto countries: Tracking global interest in cryptocurrencies
1250,GoCrypto Celebrates as Ljubljana Ranked Most Crypto-Friendly City ...
1251,[DOC] Tax treatment of activities with virtual currencies as per ZDoh-2 ...
1252,[PDF] Regulation of Cryptocurrency Around the World: November 2021 ...
1253,10 Cities That Are Bitcoin Hotspots - Investopedia
1254,South Africa crypto ownership numbers
1255,South Africa tops the list of cryptocurrency ownership among global ...
1256,Cryptocurrency ownership in SA below global average - Moonstone
1257,Crypto Adoption trends in South Africa and world in 2022
1258,Survey: Proportion of South African Crypto Holders Grows to 11.3 ...
1259,Report: South Africa ranks 21st in crypto ownership
1260,Research gives some idea about how much South Africa's ...
1261,Cryptocurrency Ownership Data for Nigeria 2021 - TripleA
1262,Cryptocurrency adoption by country 2019-2021 - Statista
1263,[PDF] Blockchain and Cryptocurrency in Africa - Baker McKenzie
1264,South Korea crypto ownership numbers
1265,Cryptocurrency Ownership Data for South Korea 2022 - TripleA
